defined_class	defined_class_label	anatomical_entity	anatomical_entity_label	location	location_label
http://purl.obolibrary.org/obo/ZP_0017481	anatomical axis trunk decreased length, abnormal	http://purl.obolibrary.org/obo/BSPO_0000010	anatomical axis	http://purl.obolibrary.org/obo/ZFA_0001115	trunk
http://purl.obolibrary.org/obo/ZP_0008280	anatomical axis whole organism decreased length, abnormal	http://purl.obolibrary.org/obo/BSPO_0000010	anatomical axis	http://purl.obolibrary.org/obo/ZFA_0001094	whole organism
http://purl.obolibrary.org/obo/ZP_0103665	angiogenic sprout intersegmental vein decreased length, abnormal	http://purl.obolibrary.org/obo/ZFA_0005604	angiogenic sprout	http://purl.obolibrary.org/obo/ZFA_0001057	intersegmental vein
http://purl.obolibrary.org/obo/ZP_0016711	angiogenic sprout intersegmental vessel decreased length, abnormal	http://purl.obolibrary.org/obo/ZFA_0005604	angiogenic sprout	http://purl.obolibrary.org/obo/ZFA_0001285	intersegmental vessel
http://purl.obolibrary.org/obo/ZP_0141075	anterior region cranium decreased length, abnormal	http://purl.obolibrary.org/obo/BSPO_0000071	anterior region	http://purl.obolibrary.org/obo/ZFA_0000737	cranium
http://purl.obolibrary.org/obo/ZP_0001711	anterior region vertebral column decreased length, abnormal	http://purl.obolibrary.org/obo/BSPO_0000071	anterior region	http://purl.obolibrary.org/obo/ZFA_0001559	vertebral column
http://purl.obolibrary.org/obo/ZP_0010588	anterior-posterior axis eye decreased length, abnormal	http://purl.obolibrary.org/obo/BSPO_0000013	anterior-posterior axis	http://purl.obolibrary.org/obo/ZFA_0000107	eye
http://purl.obolibrary.org/obo/ZP_0001706	anterior-posterior axis head decreased length, abnormal	http://purl.obolibrary.org/obo/BSPO_0000013	anterior-posterior axis	http://purl.obolibrary.org/obo/ZFA_0001114	head
http://purl.obolibrary.org/obo/ZP_0002076	anterior-posterior axis hindbrain decreased length, abnormal	http://purl.obolibrary.org/obo/BSPO_0000013	anterior-posterior axis	http://purl.obolibrary.org/obo/ZFA_0000029	hindbrain
http://purl.obolibrary.org/obo/ZP_0019041	anterior-posterior axis notochord decreased length, abnormal	http://purl.obolibrary.org/obo/BSPO_0000013	anterior-posterior axis	http://purl.obolibrary.org/obo/ZFA_0000135	notochord
http://purl.obolibrary.org/obo/ZP_0001854	anterior-posterior axis otic vesicle decreased length, abnormal	http://purl.obolibrary.org/obo/BSPO_0000013	anterior-posterior axis	http://purl.obolibrary.org/obo/ZFA_0000051	otic vesicle
http://purl.obolibrary.org/obo/ZP_0000156	anterior-posterior axis paraxial mesoderm decreased length, abnormal	http://purl.obolibrary.org/obo/BSPO_0000013	anterior-posterior axis	http://purl.obolibrary.org/obo/ZFA_0000255	paraxial mesoderm
http://purl.obolibrary.org/obo/ZP_0018140	anterior-posterior axis pharyngeal arch decreased length, abnormal	http://purl.obolibrary.org/obo/BSPO_0000013	anterior-posterior axis	http://purl.obolibrary.org/obo/ZFA_0001306	pharyngeal arch
http://purl.obolibrary.org/obo/ZP_0020814	anterior-posterior axis somite decreased length, abnormal	http://purl.obolibrary.org/obo/BSPO_0000013	anterior-posterior axis	http://purl.obolibrary.org/obo/ZFA_0000155	somite
http://purl.obolibrary.org/obo/ZP_0020655	anterior-posterior axis ventral mandibular arch decreased length, abnormal	http://purl.obolibrary.org/obo/BSPO_0000013	anterior-posterior axis	http://purl.obolibrary.org/obo/ZFA_0001273	ventral mandibular arch
http://purl.obolibrary.org/obo/ZP_0000586	anterior-posterior axis whole organism decreased length, abnormal	http://purl.obolibrary.org/obo/BSPO_0000013	anterior-posterior axis	http://purl.obolibrary.org/obo/ZFA_0001094	whole organism
http://purl.obolibrary.org/obo/ZP_0017428	apical region eye photoreceptor cell decreased length, abnormal	http://purl.obolibrary.org/obo/BSPO_0000073	apical region	http://purl.obolibrary.org/obo/ZFA_0009154	eye photoreceptor cell
http://purl.obolibrary.org/obo/ZP_0002791	apical-basal axis relative to substrate intestinal bulb epithelium decreased length, abnormal	http://purl.obolibrary.org/obo/BSPO_0000014	apical-basal axis relative to substrate	http://purl.obolibrary.org/obo/ZFA_0005126	intestinal bulb epithelium
http://purl.obolibrary.org/obo/ZP_0007464	axis whole organism decreased length, abnormal	http://purl.obolibrary.org/obo/ZFA_0000092	axis	http://purl.obolibrary.org/obo/ZFA_0001094	whole organism
http://purl.obolibrary.org/obo/ZP_0021982	blood vessel endothelial cell dorsal aorta decreased length, abnormal	http://purl.obolibrary.org/obo/ZFA_0009036	blood vessel endothelial cell	http://purl.obolibrary.org/obo/ZFA_0000014	dorsal aorta
http://purl.obolibrary.org/obo/ZP_0137801	blood vessel trunk vasculature decreased length, abnormal	http://purl.obolibrary.org/obo/ZFA_0005314	blood vessel	http://purl.obolibrary.org/obo/ZFA_0005024	trunk vasculature
http://purl.obolibrary.org/obo/ZP_0022367	bone element regenerating fin decreased length, abnormal	http://purl.obolibrary.org/obo/ZFA_0001514	bone element	http://purl.obolibrary.org/obo/ZFA_0001269	regenerating fin
http://purl.obolibrary.org/obo/ZP_0007757	bony projection palatoquadrate arch decreased length, abnormal	http://purl.obolibrary.org/obo/ZFA_0001637	bony projection	http://purl.obolibrary.org/obo/ZFA_0001272	palatoquadrate arch
http://purl.obolibrary.org/obo/ZP_0101489	cartilage element pharyngeal arch cartilage decreased length, abnormal	http://purl.obolibrary.org/obo/ZFA_0001501	cartilage element	http://purl.obolibrary.org/obo/ZFA_0001460	pharyngeal arch cartilage
http://purl.obolibrary.org/obo/ZP_0103969	caudal fin lepidotrichium regenerating fin decreased length, abnormal	http://purl.obolibrary.org/obo/ZFA_0001550	caudal fin lepidotrichium	http://purl.obolibrary.org/obo/ZFA_0001269	regenerating fin
http://purl.obolibrary.org/obo/ZP_0018320	caudal fin vasculature regenerating fin decreased length, abnormal	http://purl.obolibrary.org/obo/ZFA_0005097	caudal fin vasculature	http://purl.obolibrary.org/obo/ZFA_0001269	regenerating fin
http://purl.obolibrary.org/obo/ZP_0008126	cell lens decreased length, abnormal	http://purl.obolibrary.org/obo/ZFA_0009000	cell	http://purl.obolibrary.org/obo/ZFA_0000035	lens
http://purl.obolibrary.org/obo/ZP_0137373	cell midbrain hindbrain boundary constriction decreased length, abnormal	http://purl.obolibrary.org/obo/ZFA_0009000	cell	http://purl.obolibrary.org/obo/ZFA_0007125	midbrain hindbrain boundary constriction
http://purl.obolibrary.org/obo/ZP_0012031	cell midbrain hindbrain boundary decreased length, abnormal	http://purl.obolibrary.org/obo/ZFA_0009000	cell	http://purl.obolibrary.org/obo/ZFA_0000042	midbrain hindbrain boundary
http://purl.obolibrary.org/obo/ZP_0020817	cell notochord decreased length, abnormal	http://purl.obolibrary.org/obo/ZFA_0009000	cell	http://purl.obolibrary.org/obo/ZFA_0000135	notochord
http://purl.obolibrary.org/obo/ZP_0019893	cell presumptive neural retina decreased length, abnormal	http://purl.obolibrary.org/obo/ZFA_0009000	cell	http://purl.obolibrary.org/obo/ZFA_0001071	presumptive neural retina
http://purl.obolibrary.org/obo/ZP_0007038	ciliated cell Kupffer's vesicle decreased length, abnormal	http://purl.obolibrary.org/obo/ZFA_0009032	ciliated cell	http://purl.obolibrary.org/obo/ZFA_0000001	Kupffer's vesicle
http://purl.obolibrary.org/obo/ZP_0002422	cleavage furrow blastoderm decreased length, abnormal	http://purl.obolibrary.org/obo/GO_0032154	cleavage furrow	http://purl.obolibrary.org/obo/ZFA_0001176	blastoderm
http://purl.obolibrary.org/obo/ZP_0010902	cleithrum pectoral fin decreased length, abnormal	http://purl.obolibrary.org/obo/ZFA_0000184	cleithrum	http://purl.obolibrary.org/obo/ZFA_0001161	pectoral fin
http://purl.obolibrary.org/obo/ZP_0004415	dorsal-ventral axis brain decreased length, abnormal	http://purl.obolibrary.org/obo/BSPO_0000016	dorsal-ventral axis	http://purl.obolibrary.org/obo/ZFA_0000008	brain
http://purl.obolibrary.org/obo/ZP_0010589	dorsal-ventral axis eye decreased length, abnormal	http://purl.obolibrary.org/obo/BSPO_0000016	dorsal-ventral axis	http://purl.obolibrary.org/obo/ZFA_0000107	eye
http://purl.obolibrary.org/obo/ZP_0005830	dorsal-ventral axis head decreased length, abnormal	http://purl.obolibrary.org/obo/BSPO_0000016	dorsal-ventral axis	http://purl.obolibrary.org/obo/ZFA_0001114	head
http://purl.obolibrary.org/obo/ZP_0007956	dorsal-ventral axis opercle decreased length, abnormal	http://purl.obolibrary.org/obo/BSPO_0000016	dorsal-ventral axis	http://purl.obolibrary.org/obo/ZFA_0000250	opercle
http://purl.obolibrary.org/obo/ZP_0004141	dorsal-ventral axis whole organism decreased length, abnormal	http://purl.obolibrary.org/obo/BSPO_0000016	dorsal-ventral axis	http://purl.obolibrary.org/obo/ZFA_0001094	whole organism
http://purl.obolibrary.org/obo/ZP_0002667	endocardium atrioventricular canal decreased length, abnormal	http://purl.obolibrary.org/obo/ZFA_0001320	endocardium	http://purl.obolibrary.org/obo/ZFA_0001315	atrioventricular canal
http://purl.obolibrary.org/obo/ZP_0009047	intestinal villus male organism decreased length, abnormal	http://purl.obolibrary.org/obo/ZFA_0005125	intestinal villus	http://purl.obolibrary.org/obo/ZFA_0000242	male organism
http://purl.obolibrary.org/obo/ZP_0012282	lateral region facial lymphatic vessel decreased length, abnormal	http://purl.obolibrary.org/obo/BSPO_0000082	lateral region	http://purl.obolibrary.org/obo/ZFA_0005108	facial lymphatic vessel
http://purl.obolibrary.org/obo/ZP_0014048	lepidotrichium segment regenerating fin decreased length, abnormal	http://purl.obolibrary.org/obo/ZFA_0005633	lepidotrichium segment	http://purl.obolibrary.org/obo/ZFA_0001269	regenerating fin
http://purl.obolibrary.org/obo/ZP_0003324	motor neuron spinal cord decreased length, abnormal	http://purl.obolibrary.org/obo/ZFA_0009052	motor neuron	http://purl.obolibrary.org/obo/ZFA_0000075	spinal cord
http://purl.obolibrary.org/obo/ZP_0007983	muscle cell myotome decreased length, abnormal	http://purl.obolibrary.org/obo/ZFA_0009114	muscle cell	http://purl.obolibrary.org/obo/ZFA_0001056	myotome
http://purl.obolibrary.org/obo/ZP_0005604	muscle cell somite decreased length, abnormal	http://purl.obolibrary.org/obo/ZFA_0009114	muscle cell	http://purl.obolibrary.org/obo/ZFA_0000155	somite
http://purl.obolibrary.org/obo/ZP_0102826	post-vent vasculature regenerating fin decreased length, abnormal	http://purl.obolibrary.org/obo/ZFA_0005037	post-vent vasculature	http://purl.obolibrary.org/obo/ZFA_0001269	regenerating fin
http://purl.obolibrary.org/obo/ZP_0010470	posterior region prechordal plate decreased length, abnormal	http://purl.obolibrary.org/obo/BSPO_0000072	posterior region	http://purl.obolibrary.org/obo/ZFA_0000060	prechordal plate
http://purl.obolibrary.org/obo/ZP_0014785	posterior region trunk decreased length, abnormal	http://purl.obolibrary.org/obo/BSPO_0000072	posterior region	http://purl.obolibrary.org/obo/ZFA_0001115	trunk
http://purl.obolibrary.org/obo/ZP_0007959	postero-ventral margin opercle decreased length, abnormal	http://purl.obolibrary.org/obo/BSPO_0000689	postero-ventral margin	http://purl.obolibrary.org/obo/ZFA_0000250	opercle
http://purl.obolibrary.org/obo/ZP_0008395	proximal region neurocranial trabecula decreased length, abnormal	http://purl.obolibrary.org/obo/BSPO_0000077	proximal region	http://purl.obolibrary.org/obo/ZFA_0001321	neurocranial trabecula
http://purl.obolibrary.org/obo/ZP_0001699	proximal region pronephric duct decreased length, abnormal	http://purl.obolibrary.org/obo/BSPO_0000077	proximal region	http://purl.obolibrary.org/obo/ZFA_0000150	pronephric duct
http://purl.obolibrary.org/obo/ZP_0102467	regenerating fin caudal fin decreased length, abnormal	http://purl.obolibrary.org/obo/ZFA_0001269	regenerating fin	http://purl.obolibrary.org/obo/ZFA_0001058	caudal fin
http://purl.obolibrary.org/obo/ZP_0021395	regenerating tissue lateral rectus decreased length, abnormal	http://purl.obolibrary.org/obo/ZFA_0005147	regenerating tissue	http://purl.obolibrary.org/obo/ZFA_0000383	lateral rectus
http://purl.obolibrary.org/obo/ZP_0141763	retinal cone cell retinal outer nuclear layer decreased length, abnormal	http://purl.obolibrary.org/obo/ZFA_0009262	retinal cone cell	http://purl.obolibrary.org/obo/ZFA_0001464	retinal outer nuclear layer
http://purl.obolibrary.org/obo/ZP_0103631	transverse plane eye decreased length, abnormal	http://purl.obolibrary.org/obo/BSPO_0000018	transverse plane	http://purl.obolibrary.org/obo/ZFA_0000107	eye
http://purl.obolibrary.org/obo/ZP_0022776	vasculature regenerating fin decreased length, abnormal	http://purl.obolibrary.org/obo/ZFA_0005249	vasculature	http://purl.obolibrary.org/obo/ZFA_0001269	regenerating fin
http://purl.obolibrary.org/obo/ZP_0010465	ventral region central nervous system decreased length, abnormal	http://purl.obolibrary.org/obo/BSPO_0000084	ventral region	http://purl.obolibrary.org/obo/ZFA_0000012	central nervous system
http://purl.obolibrary.org/obo/ZP_0138320	yolk extension decreased length, abnormal	http://purl.obolibrary.org/obo/ZFA_0000084	yolk	http://purl.obolibrary.org/obo/ZFA_0000106	extension
