defined_class	defined_class_label	anatomical_entity	anatomical_entity_label	location	location_label
http://purl.obolibrary.org/obo/ZP_0102713	GABAergic neuron diencephalon amount, abnormal	http://purl.obolibrary.org/obo/ZFA_0009276	GABAergic neuron	http://purl.obolibrary.org/obo/ZFA_0000101	diencephalon
http://purl.obolibrary.org/obo/ZP_0102711	GABAergic neuron hindbrain amount, abnormal	http://purl.obolibrary.org/obo/ZFA_0009276	GABAergic neuron	http://purl.obolibrary.org/obo/ZFA_0000029	hindbrain
http://purl.obolibrary.org/obo/ZP_0102714	GABAergic neuron midbrain amount, abnormal	http://purl.obolibrary.org/obo/ZFA_0009276	GABAergic neuron	http://purl.obolibrary.org/obo/ZFA_0000128	midbrain
http://purl.obolibrary.org/obo/ZP_0003768	GABAergic neuron spinal cord amount, abnormal	http://purl.obolibrary.org/obo/ZFA_0009276	GABAergic neuron	http://purl.obolibrary.org/obo/ZFA_0000075	spinal cord
http://purl.obolibrary.org/obo/ZP_0102712	GABAergic neuron telencephalon amount, abnormal	http://purl.obolibrary.org/obo/ZFA_0009276	GABAergic neuron	http://purl.obolibrary.org/obo/ZFA_0000079	telencephalon
http://purl.obolibrary.org/obo/ZP_0101680	L-type voltage-gated calcium channel complex muscle cell amount, abnormal	http://purl.obolibrary.org/obo/GO_1990454	L-type voltage-gated calcium channel complex	http://purl.obolibrary.org/obo/ZFA_0009114	muscle cell
http://purl.obolibrary.org/obo/ZP_0017203	NCC ionocyte gill filament amount, abnormal	http://purl.obolibrary.org/obo/ZFA_0005579	NCC ionocyte	http://purl.obolibrary.org/obo/ZFA_0000667	gill filament
http://purl.obolibrary.org/obo/ZP_0014899	Rohon-Beard neuron spinal cord amount, abnormal	http://purl.obolibrary.org/obo/ZFA_0009150	Rohon-Beard neuron	http://purl.obolibrary.org/obo/ZFA_0000075	spinal cord
http://purl.obolibrary.org/obo/ZP_0100737	Z disc cardiac muscle cell amount, abnormal	http://purl.obolibrary.org/obo/GO_0030018	Z disc	http://purl.obolibrary.org/obo/ZFA_0009316	cardiac muscle cell
http://purl.obolibrary.org/obo/ZP_0020950	Z disc ventricular myocardium amount, abnormal	http://purl.obolibrary.org/obo/GO_0030018	Z disc	http://purl.obolibrary.org/obo/ZFA_0005061	ventricular myocardium
http://purl.obolibrary.org/obo/ZP_0022457	acetylcholine-gated channel complex muscle amount, abnormal	http://purl.obolibrary.org/obo/GO_0005892	acetylcholine-gated channel complex	http://purl.obolibrary.org/obo/ZFA_0005145	muscle
http://purl.obolibrary.org/obo/ZP_0101148	adipose tissue whole organism amount, abnormal	http://purl.obolibrary.org/obo/ZFA_0005345	adipose tissue	http://purl.obolibrary.org/obo/ZFA_0001094	whole organism
http://purl.obolibrary.org/obo/ZP_0021314	angiogenic sprout intersegmental vessel amount, abnormal	http://purl.obolibrary.org/obo/ZFA_0005604	angiogenic sprout	http://purl.obolibrary.org/obo/ZFA_0001285	intersegmental vessel
http://purl.obolibrary.org/obo/ZP_0022450	angiogenic sprout trunk vasculature amount, abnormal	http://purl.obolibrary.org/obo/ZFA_0005604	angiogenic sprout	http://purl.obolibrary.org/obo/ZFA_0005024	trunk vasculature
http://purl.obolibrary.org/obo/ZP_0021432	anterior region pronephric duct amount, abnormal	http://purl.obolibrary.org/obo/BSPO_0000071	anterior region	http://purl.obolibrary.org/obo/ZFA_0000150	pronephric duct
http://purl.obolibrary.org/obo/ZP_0023024	apical plasma membrane pronephric duct amount, abnormal	http://purl.obolibrary.org/obo/GO_0016324	apical plasma membrane	http://purl.obolibrary.org/obo/ZFA_0000150	pronephric duct
http://purl.obolibrary.org/obo/ZP_0022594	artery cranial vasculature amount, abnormal	http://purl.obolibrary.org/obo/ZFA_0000005	artery	http://purl.obolibrary.org/obo/ZFA_0001267	cranial vasculature
http://purl.obolibrary.org/obo/ZP_0013643	axon anterior commissure amount, abnormal	http://purl.obolibrary.org/obo/GO_0030424	axon	http://purl.obolibrary.org/obo/ZFA_0001108	anterior commissure
http://purl.obolibrary.org/obo/ZP_0021796	axon commissure of the tract of the commissure of the caudal tuberculum amount, abnormal	http://purl.obolibrary.org/obo/GO_0030424	axon	http://purl.obolibrary.org/obo/ZFA_0005877	commissure of the tract of the commissure of the caudal tuberculum
http://purl.obolibrary.org/obo/ZP_0022805	axon optic tectum amount, abnormal	http://purl.obolibrary.org/obo/GO_0030424	axon	http://purl.obolibrary.org/obo/ZFA_0000445	optic tectum
http://purl.obolibrary.org/obo/ZP_0017659	axon posterior lateral line amount, abnormal	http://purl.obolibrary.org/obo/GO_0030424	axon	http://purl.obolibrary.org/obo/ZFA_0000944	posterior lateral line
http://purl.obolibrary.org/obo/ZP_0100349	axon trigeminal ganglion amount, abnormal	http://purl.obolibrary.org/obo/GO_0030424	axon	http://purl.obolibrary.org/obo/ZFA_0000295	trigeminal ganglion
http://purl.obolibrary.org/obo/ZP_0013310	blood vessel endothelial cell axial vasculature amount, abnormal	http://purl.obolibrary.org/obo/ZFA_0009036	blood vessel endothelial cell	http://purl.obolibrary.org/obo/ZFA_0001073	axial vasculature
http://purl.obolibrary.org/obo/ZP_0102584	blood vessel endothelial cell dorsal aorta amount, abnormal	http://purl.obolibrary.org/obo/ZFA_0009036	blood vessel endothelial cell	http://purl.obolibrary.org/obo/ZFA_0000014	dorsal aorta
http://purl.obolibrary.org/obo/ZP_0015060	blood vessel endothelial cell intersegmental artery amount, abnormal	http://purl.obolibrary.org/obo/ZFA_0009036	blood vessel endothelial cell	http://purl.obolibrary.org/obo/ZFA_0001061	intersegmental artery
http://purl.obolibrary.org/obo/ZP_0100023	cardiac muscle cell atrial myocardium amount, abnormal	http://purl.obolibrary.org/obo/ZFA_0009316	cardiac muscle cell	http://purl.obolibrary.org/obo/ZFA_0001374	atrial myocardium
http://purl.obolibrary.org/obo/ZP_0013958	cardiac muscle cell atrium amount, abnormal	http://purl.obolibrary.org/obo/ZFA_0009316	cardiac muscle cell	http://purl.obolibrary.org/obo/ZFA_0000471	atrium
http://purl.obolibrary.org/obo/ZP_0100533	cardiac muscle cell cardiac ventricle amount, abnormal	http://purl.obolibrary.org/obo/ZFA_0009316	cardiac muscle cell	http://purl.obolibrary.org/obo/ZFA_0000009	cardiac ventricle
http://purl.obolibrary.org/obo/ZP_0013860	cardiac muscle cell heart amount, abnormal	http://purl.obolibrary.org/obo/ZFA_0009316	cardiac muscle cell	http://purl.obolibrary.org/obo/ZFA_0000114	heart
http://purl.obolibrary.org/obo/ZP_0013001	cardiac muscle cell myocardium amount, abnormal	http://purl.obolibrary.org/obo/ZFA_0009316	cardiac muscle cell	http://purl.obolibrary.org/obo/ZFA_0001319	myocardium
http://purl.obolibrary.org/obo/ZP_0100024	cardiac muscle cell ventricular myocardium amount, abnormal	http://purl.obolibrary.org/obo/ZFA_0009316	cardiac muscle cell	http://purl.obolibrary.org/obo/ZFA_0005061	ventricular myocardium
http://purl.obolibrary.org/obo/ZP_0014929	cell endocardial cushion amount, abnormal	http://purl.obolibrary.org/obo/ZFA_0009000	cell	http://purl.obolibrary.org/obo/ZFA_0001317	endocardial cushion
http://purl.obolibrary.org/obo/ZP_0101603	cell eye amount, abnormal	http://purl.obolibrary.org/obo/ZFA_0009000	cell	http://purl.obolibrary.org/obo/ZFA_0000107	eye
http://purl.obolibrary.org/obo/ZP_0102312	cell interrenal gland amount, abnormal	http://purl.obolibrary.org/obo/ZFA_0009000	cell	http://purl.obolibrary.org/obo/ZFA_0001345	interrenal gland
http://purl.obolibrary.org/obo/ZP_0101548	cell intersegmental vessel amount, abnormal	http://purl.obolibrary.org/obo/ZFA_0009000	cell	http://purl.obolibrary.org/obo/ZFA_0001285	intersegmental vessel
http://purl.obolibrary.org/obo/ZP_0100629	cell intestine amount, abnormal	http://purl.obolibrary.org/obo/ZFA_0009000	cell	http://purl.obolibrary.org/obo/ZFA_0001338	intestine
http://purl.obolibrary.org/obo/ZP_0102691	cell projection myelin accumulating cell amount, abnormal	http://purl.obolibrary.org/obo/GO_0042995	cell projection	http://purl.obolibrary.org/obo/ZFA_0009163	myelin accumulating cell
http://purl.obolibrary.org/obo/ZP_0015996	cell retinal ganglion cell layer amount, abnormal	http://purl.obolibrary.org/obo/ZFA_0009000	cell	http://purl.obolibrary.org/obo/ZFA_0000024	retinal ganglion cell layer
http://purl.obolibrary.org/obo/ZP_0103561	cell roof plate amount, abnormal	http://purl.obolibrary.org/obo/ZFA_0009000	cell	http://purl.obolibrary.org/obo/ZFA_0007058	roof plate
http://purl.obolibrary.org/obo/ZP_0017574	cell ventricular zone amount, abnormal	http://purl.obolibrary.org/obo/ZFA_0009000	cell	http://purl.obolibrary.org/obo/ZFA_0001083	ventricular zone
http://purl.obolibrary.org/obo/ZP_0021883	cell whole organism amount, abnormal	http://purl.obolibrary.org/obo/ZFA_0009000	cell	http://purl.obolibrary.org/obo/ZFA_0001094	whole organism
http://purl.obolibrary.org/obo/ZP_0101921	central region retina amount, abnormal	http://purl.obolibrary.org/obo/BSPO_0000075	central region	http://purl.obolibrary.org/obo/ZFA_0000152	retina
http://purl.obolibrary.org/obo/ZP_0103623	cholangiocyte liver amount, abnormal	http://purl.obolibrary.org/obo/ZFA_0009397	cholangiocyte	http://purl.obolibrary.org/obo/ZFA_0000123	liver
http://purl.obolibrary.org/obo/ZP_0103761	cholinergic synapse myotome amount, abnormal	http://purl.obolibrary.org/obo/GO_0098981	cholinergic synapse	http://purl.obolibrary.org/obo/ZFA_0001056	myotome
http://purl.obolibrary.org/obo/ZP_0022608	chondrocyte Meckel's cartilage amount, abnormal	http://purl.obolibrary.org/obo/ZFA_0009084	chondrocyte	http://purl.obolibrary.org/obo/ZFA_0001205	Meckel's cartilage
http://purl.obolibrary.org/obo/ZP_0100540	chondrocyte ceratohyal cartilage amount, abnormal	http://purl.obolibrary.org/obo/ZFA_0009084	chondrocyte	http://purl.obolibrary.org/obo/ZFA_0001400	ceratohyal cartilage
http://purl.obolibrary.org/obo/ZP_0014480	chondrocyte palatoquadrate cartilage amount, abnormal	http://purl.obolibrary.org/obo/ZFA_0009084	chondrocyte	http://purl.obolibrary.org/obo/ZFA_0001399	palatoquadrate cartilage
http://purl.obolibrary.org/obo/ZP_0019256	chromosome cell amount, abnormal	http://purl.obolibrary.org/obo/GO_0005694	chromosome	http://purl.obolibrary.org/obo/ZFA_0009000	cell
http://purl.obolibrary.org/obo/ZP_0002274	chromosome peripheral nervous system amount, abnormal	http://purl.obolibrary.org/obo/GO_0005694	chromosome	http://purl.obolibrary.org/obo/ZFA_0000142	peripheral nervous system
http://purl.obolibrary.org/obo/ZP_0100469	cilium Kupffer's vesicle amount, abnormal	http://purl.obolibrary.org/obo/GO_0005929	cilium	http://purl.obolibrary.org/obo/ZFA_0000001	Kupffer's vesicle
http://purl.obolibrary.org/obo/ZP_0101446	cilium pronephric duct amount, abnormal	http://purl.obolibrary.org/obo/GO_0005929	cilium	http://purl.obolibrary.org/obo/ZFA_0000150	pronephric duct
http://purl.obolibrary.org/obo/ZP_0018325	common myeloid progenitor blood amount, abnormal	http://purl.obolibrary.org/obo/ZFA_0009021	common myeloid progenitor	http://purl.obolibrary.org/obo/ZFA_0000007	blood
http://purl.obolibrary.org/obo/ZP_0021244	cytoplasmic vesicle pronephric proximal convoluted tubule amount, abnormal	http://purl.obolibrary.org/obo/GO_0031410	cytoplasmic vesicle	http://purl.obolibrary.org/obo/ZFA_0001620	pronephric proximal convoluted tubule
http://purl.obolibrary.org/obo/ZP_0021245	cytoplasmic vesicle pronephric proximal straight tubule amount, abnormal	http://purl.obolibrary.org/obo/GO_0031410	cytoplasmic vesicle	http://purl.obolibrary.org/obo/ZFA_0001621	pronephric proximal straight tubule
http://purl.obolibrary.org/obo/ZP_0017592	dopaminergic neuron caudal tuberculum amount, abnormal	http://purl.obolibrary.org/obo/ZFA_0009301	dopaminergic neuron	http://purl.obolibrary.org/obo/ZFA_0000633	caudal tuberculum
http://purl.obolibrary.org/obo/ZP_0100757	dopaminergic neuron diencephalon amount, abnormal	http://purl.obolibrary.org/obo/ZFA_0009301	dopaminergic neuron	http://purl.obolibrary.org/obo/ZFA_0000101	diencephalon
http://purl.obolibrary.org/obo/ZP_0100839	dopaminergic neuron hypothalamus amount, abnormal	http://purl.obolibrary.org/obo/ZFA_0009301	dopaminergic neuron	http://purl.obolibrary.org/obo/ZFA_0000032	hypothalamus
http://purl.obolibrary.org/obo/ZP_0021643	dopaminergic neuron midbrain amount, abnormal	http://purl.obolibrary.org/obo/ZFA_0009301	dopaminergic neuron	http://purl.obolibrary.org/obo/ZFA_0000128	midbrain
http://purl.obolibrary.org/obo/ZP_0017439	endocytic vesicle pronephric duct amount, abnormal	http://purl.obolibrary.org/obo/GO_0030139	endocytic vesicle	http://purl.obolibrary.org/obo/ZFA_0000150	pronephric duct
http://purl.obolibrary.org/obo/ZP_0017437	endosome pronephric duct amount, abnormal	http://purl.obolibrary.org/obo/GO_0005768	endosome	http://purl.obolibrary.org/obo/ZFA_0000150	pronephric duct
http://purl.obolibrary.org/obo/ZP_0013054	endothelial cell caudal vein amount, abnormal	http://purl.obolibrary.org/obo/ZFA_0009065	endothelial cell	http://purl.obolibrary.org/obo/ZFA_0000180	caudal vein
http://purl.obolibrary.org/obo/ZP_0017552	endothelial cell caudal vein plexus amount, abnormal	http://purl.obolibrary.org/obo/ZFA_0009065	endothelial cell	http://purl.obolibrary.org/obo/ZFA_0001286	caudal vein plexus
http://purl.obolibrary.org/obo/ZP_0101922	endothelial cell intersegmental vessel amount, abnormal	http://purl.obolibrary.org/obo/ZFA_0009065	endothelial cell	http://purl.obolibrary.org/obo/ZFA_0001285	intersegmental vessel
http://purl.obolibrary.org/obo/ZP_0022931	endothelial cell otolithic lymph vessel amount, abnormal	http://purl.obolibrary.org/obo/ZFA_0009065	endothelial cell	http://purl.obolibrary.org/obo/ZFA_0005838	otolithic lymph vessel
http://purl.obolibrary.org/obo/ZP_0013058	endothelial cell posterior cardinal vein amount, abnormal	http://purl.obolibrary.org/obo/ZFA_0009065	endothelial cell	http://purl.obolibrary.org/obo/ZFA_0000477	posterior cardinal vein
http://purl.obolibrary.org/obo/ZP_0018265	endothelial cell primordial hindbrain channel amount, abnormal	http://purl.obolibrary.org/obo/ZFA_0009065	endothelial cell	http://purl.obolibrary.org/obo/ZFA_0001052	primordial hindbrain channel
http://purl.obolibrary.org/obo/ZP_0013060	endothelial cell subintestinal vein amount, abnormal	http://purl.obolibrary.org/obo/ZFA_0009065	endothelial cell	http://purl.obolibrary.org/obo/ZFA_0005035	subintestinal vein
http://purl.obolibrary.org/obo/ZP_0022244	epidermal cell caudal fin amount, abnormal	http://purl.obolibrary.org/obo/ZFA_0009183	epidermal cell	http://purl.obolibrary.org/obo/ZFA_0001058	caudal fin
http://purl.obolibrary.org/obo/ZP_0022775	epithelial cell pronephric tubule amount, abnormal	http://purl.obolibrary.org/obo/ZFA_0009034	epithelial cell	http://purl.obolibrary.org/obo/ZFA_0001558	pronephric tubule
http://purl.obolibrary.org/obo/ZP_0022902	erythroid progenitor cell post-vent region amount, abnormal	http://purl.obolibrary.org/obo/ZFA_0009015	erythroid progenitor cell	http://purl.obolibrary.org/obo/ZFA_0001117	post-vent region
http://purl.obolibrary.org/obo/ZP_0101927	filopodium intersegmental vessel amount, abnormal	http://purl.obolibrary.org/obo/GO_0030175	filopodium	http://purl.obolibrary.org/obo/ZFA_0001285	intersegmental vessel
http://purl.obolibrary.org/obo/ZP_0011393	glial cell (sensu Vertebrata) floor plate spinal cord region amount, abnormal	http://purl.obolibrary.org/obo/ZFA_0009147	glial cell (sensu Vertebrata)	http://purl.obolibrary.org/obo/ZFA_0000890	floor plate spinal cord region
http://purl.obolibrary.org/obo/ZP_0012853	glial cell (sensu Vertebrata) ventricular zone amount, abnormal	http://purl.obolibrary.org/obo/ZFA_0009147	glial cell (sensu Vertebrata)	http://purl.obolibrary.org/obo/ZFA_0001083	ventricular zone
http://purl.obolibrary.org/obo/ZP_0021935	glial cell spinal cord amount, abnormal	http://purl.obolibrary.org/obo/ZFA_0009073	glial cell	http://purl.obolibrary.org/obo/ZFA_0000075	spinal cord
http://purl.obolibrary.org/obo/ZP_0013970	goblet cell intestine amount, abnormal	http://purl.obolibrary.org/obo/ZFA_0009094	goblet cell	http://purl.obolibrary.org/obo/ZFA_0001338	intestine
http://purl.obolibrary.org/obo/ZP_0012933	hair cell macula utricle amount, abnormal	http://purl.obolibrary.org/obo/ZFA_0009366	hair cell	http://purl.obolibrary.org/obo/ZFA_0000030	macula utricle
http://purl.obolibrary.org/obo/ZP_0014917	hair cell otic vesicle amount, abnormal	http://purl.obolibrary.org/obo/ZFA_0009366	hair cell	http://purl.obolibrary.org/obo/ZFA_0000051	otic vesicle
http://purl.obolibrary.org/obo/ZP_0103198	hair cell posterior lateral line neuromast amount, abnormal	http://purl.obolibrary.org/obo/ZFA_0009366	hair cell	http://purl.obolibrary.org/obo/ZFA_0000940	posterior lateral line neuromast
http://purl.obolibrary.org/obo/ZP_0018328	hematopoietic multipotent progenitor cell blood amount, abnormal	http://purl.obolibrary.org/obo/ZFA_0009354	hematopoietic multipotent progenitor cell	http://purl.obolibrary.org/obo/ZFA_0000007	blood
http://purl.obolibrary.org/obo/ZP_0101627	hematopoietic multipotent progenitor cell intermediate cell mass of mesoderm amount, abnormal	http://purl.obolibrary.org/obo/ZFA_0009354	hematopoietic multipotent progenitor cell	http://purl.obolibrary.org/obo/ZFA_0000033	intermediate cell mass of mesoderm
http://purl.obolibrary.org/obo/ZP_0022903	hematopoietic multipotent progenitor cell post-vent region amount, abnormal	http://purl.obolibrary.org/obo/ZFA_0009354	hematopoietic multipotent progenitor cell	http://purl.obolibrary.org/obo/ZFA_0001117	post-vent region
http://purl.obolibrary.org/obo/ZP_0100453	hematopoietic multipotent progenitor cell ventral wall of dorsal aorta amount, abnormal	http://purl.obolibrary.org/obo/ZFA_0009354	hematopoietic multipotent progenitor cell	http://purl.obolibrary.org/obo/ZFA_0005028	ventral wall of dorsal aorta
http://purl.obolibrary.org/obo/ZP_0102759	hematopoietic stem cell blood island amount, abnormal	http://purl.obolibrary.org/obo/ZFA_0009014	hematopoietic stem cell	http://purl.obolibrary.org/obo/ZFA_0000094	blood island
http://purl.obolibrary.org/obo/ZP_0102834	hematopoietic stem cell caudal hematopoietic tissue amount, abnormal	http://purl.obolibrary.org/obo/ZFA_0009014	hematopoietic stem cell	http://purl.obolibrary.org/obo/ZFA_0005898	caudal hematopoietic tissue
http://purl.obolibrary.org/obo/ZP_0022780	hematopoietic stem cell dorsal aorta amount, abnormal	http://purl.obolibrary.org/obo/ZFA_0009014	hematopoietic stem cell	http://purl.obolibrary.org/obo/ZFA_0000014	dorsal aorta
http://purl.obolibrary.org/obo/ZP_0102761	hematopoietic stem cell head kidney amount, abnormal	http://purl.obolibrary.org/obo/ZFA_0009014	hematopoietic stem cell	http://purl.obolibrary.org/obo/ZFA_0000669	head kidney
http://purl.obolibrary.org/obo/ZP_0100647	hematopoietic stem cell ventral wall of dorsal aorta amount, abnormal	http://purl.obolibrary.org/obo/ZFA_0009014	hematopoietic stem cell	http://purl.obolibrary.org/obo/ZFA_0005028	ventral wall of dorsal aorta
http://purl.obolibrary.org/obo/ZP_0100331	hemoglobin complex nucleate erythrocyte amount, abnormal	http://purl.obolibrary.org/obo/GO_0005833	hemoglobin complex	http://purl.obolibrary.org/obo/ZFA_0009256	nucleate erythrocyte
http://purl.obolibrary.org/obo/ZP_0022126	hepatocyte male organism amount, abnormal	http://purl.obolibrary.org/obo/ZFA_0009111	hepatocyte	http://purl.obolibrary.org/obo/ZFA_0000242	male organism
http://purl.obolibrary.org/obo/ZP_0013717	iridophore eye amount, abnormal	http://purl.obolibrary.org/obo/ZFA_0009199	iridophore	http://purl.obolibrary.org/obo/ZFA_0000107	eye
http://purl.obolibrary.org/obo/ZP_0022799	keratinocyte epidermal basal stratum amount, abnormal	http://purl.obolibrary.org/obo/ZFA_0009158	keratinocyte	http://purl.obolibrary.org/obo/ZFA_0001180	epidermal basal stratum
http://purl.obolibrary.org/obo/ZP_0013174	lipid droplet fat cell amount, abnormal	http://purl.obolibrary.org/obo/GO_0005811	lipid droplet	http://purl.obolibrary.org/obo/ZFA_0009082	fat cell
http://purl.obolibrary.org/obo/ZP_0103649	lipid droplet liver amount, abnormal	http://purl.obolibrary.org/obo/GO_0005811	lipid droplet	http://purl.obolibrary.org/obo/ZFA_0000123	liver
http://purl.obolibrary.org/obo/ZP_0104503	liver female organism amount, abnormal	http://purl.obolibrary.org/obo/ZFA_0000123	liver	http://purl.obolibrary.org/obo/ZFA_0000303	female organism
http://purl.obolibrary.org/obo/ZP_0101096	liver male organism amount, abnormal	http://purl.obolibrary.org/obo/ZFA_0000123	liver	http://purl.obolibrary.org/obo/ZFA_0000242	male organism
http://purl.obolibrary.org/obo/ZP_0022170	lymphangioblast horizontal myoseptum amount, abnormal	http://purl.obolibrary.org/obo/ZFA_0009393	lymphangioblast	http://purl.obolibrary.org/obo/ZFA_0000671	horizontal myoseptum
http://purl.obolibrary.org/obo/ZP_0021468	lymphangiogenic sprout intestinal lymphatic network amount, abnormal	http://purl.obolibrary.org/obo/ZFA_0005603	lymphangiogenic sprout	http://purl.obolibrary.org/obo/ZFA_0005840	intestinal lymphatic network
http://purl.obolibrary.org/obo/ZP_0018326	lymphocyte blood amount, abnormal	http://purl.obolibrary.org/obo/ZFA_0009250	lymphocyte	http://purl.obolibrary.org/obo/ZFA_0000007	blood
http://purl.obolibrary.org/obo/ZP_0021665	lymphocyte head kidney amount, abnormal	http://purl.obolibrary.org/obo/ZFA_0009250	lymphocyte	http://purl.obolibrary.org/obo/ZFA_0000669	head kidney
http://purl.obolibrary.org/obo/ZP_0022144	macrophage blood amount, abnormal	http://purl.obolibrary.org/obo/ZFA_0009141	macrophage	http://purl.obolibrary.org/obo/ZFA_0000007	blood
http://purl.obolibrary.org/obo/ZP_0103500	macrophage head amount, abnormal	http://purl.obolibrary.org/obo/ZFA_0009141	macrophage	http://purl.obolibrary.org/obo/ZFA_0001114	head
http://purl.obolibrary.org/obo/ZP_0021261	macrophage hindbrain amount, abnormal	http://purl.obolibrary.org/obo/ZFA_0009141	macrophage	http://purl.obolibrary.org/obo/ZFA_0000029	hindbrain
http://purl.obolibrary.org/obo/ZP_0021409	macrophage intestine amount, abnormal	http://purl.obolibrary.org/obo/ZFA_0009141	macrophage	http://purl.obolibrary.org/obo/ZFA_0001338	intestine
http://purl.obolibrary.org/obo/ZP_0023040	macrophage liver amount, abnormal	http://purl.obolibrary.org/obo/ZFA_0009141	macrophage	http://purl.obolibrary.org/obo/ZFA_0000123	liver
http://purl.obolibrary.org/obo/ZP_0022132	macrophage male organism amount, abnormal	http://purl.obolibrary.org/obo/ZFA_0009141	macrophage	http://purl.obolibrary.org/obo/ZFA_0000242	male organism
http://purl.obolibrary.org/obo/ZP_0021262	macrophage midbrain amount, abnormal	http://purl.obolibrary.org/obo/ZFA_0009141	macrophage	http://purl.obolibrary.org/obo/ZFA_0000128	midbrain
http://purl.obolibrary.org/obo/ZP_0101557	macrophage regenerating fin amount, abnormal	http://purl.obolibrary.org/obo/ZFA_0009141	macrophage	http://purl.obolibrary.org/obo/ZFA_0001269	regenerating fin
http://purl.obolibrary.org/obo/ZP_0102804	macrophage whole organism amount, abnormal	http://purl.obolibrary.org/obo/ZFA_0009141	macrophage	http://purl.obolibrary.org/obo/ZFA_0001094	whole organism
http://purl.obolibrary.org/obo/ZP_0102107	mature B cell head kidney amount, abnormal	http://purl.obolibrary.org/obo/ZFA_0009331	mature B cell	http://purl.obolibrary.org/obo/ZFA_0000669	head kidney
http://purl.obolibrary.org/obo/ZP_0012780	melanocyte head amount, abnormal	http://purl.obolibrary.org/obo/ZFA_0009091	melanocyte	http://purl.obolibrary.org/obo/ZFA_0001114	head
http://purl.obolibrary.org/obo/ZP_0013720	melanocyte melanophore stripe amount, abnormal	http://purl.obolibrary.org/obo/ZFA_0009091	melanocyte	http://purl.obolibrary.org/obo/ZFA_0001463	melanophore stripe
http://purl.obolibrary.org/obo/ZP_0013677	melanocyte trunk amount, abnormal	http://purl.obolibrary.org/obo/ZFA_0009091	melanocyte	http://purl.obolibrary.org/obo/ZFA_0001115	trunk
http://purl.obolibrary.org/obo/ZP_0017520	melanosome retinal pigmented epithelium amount, abnormal	http://purl.obolibrary.org/obo/GO_0042470	melanosome	http://purl.obolibrary.org/obo/ZFA_0000144	retinal pigmented epithelium
http://purl.obolibrary.org/obo/ZP_0022971	microglial cell hindbrain amount, abnormal	http://purl.obolibrary.org/obo/ZFA_0009077	microglial cell	http://purl.obolibrary.org/obo/ZFA_0000029	hindbrain
http://purl.obolibrary.org/obo/ZP_0103437	microglial cell midbrain amount, abnormal	http://purl.obolibrary.org/obo/ZFA_0009077	microglial cell	http://purl.obolibrary.org/obo/ZFA_0000128	midbrain
http://purl.obolibrary.org/obo/ZP_0102507	microglial cell optic tectum amount, abnormal	http://purl.obolibrary.org/obo/ZFA_0009077	microglial cell	http://purl.obolibrary.org/obo/ZFA_0000445	optic tectum
http://purl.obolibrary.org/obo/ZP_0018254	mitochondrial chromosome whole organism amount, abnormal	http://purl.obolibrary.org/obo/GO_0000262	mitochondrial chromosome	http://purl.obolibrary.org/obo/ZFA_0001094	whole organism
http://purl.obolibrary.org/obo/ZP_0102445	mitochondrion erythroblast amount, abnormal	http://purl.obolibrary.org/obo/GO_0005739	mitochondrion	http://purl.obolibrary.org/obo/ZFA_0005237	erythroblast
http://purl.obolibrary.org/obo/ZP_0102854	mitochondrion liver amount, abnormal	http://purl.obolibrary.org/obo/GO_0005739	mitochondrion	http://purl.obolibrary.org/obo/ZFA_0000123	liver
http://purl.obolibrary.org/obo/ZP_0104164	mitochondrion whole organism amount, abnormal	http://purl.obolibrary.org/obo/GO_0005739	mitochondrion	http://purl.obolibrary.org/obo/ZFA_0001094	whole organism
http://purl.obolibrary.org/obo/ZP_0100059	motile cilium Kupffer's vesicle amount, abnormal	http://purl.obolibrary.org/obo/GO_0031514	motile cilium	http://purl.obolibrary.org/obo/ZFA_0000001	Kupffer's vesicle
http://purl.obolibrary.org/obo/ZP_0013312	motile cilium floor plate amount, abnormal	http://purl.obolibrary.org/obo/GO_0031514	motile cilium	http://purl.obolibrary.org/obo/ZFA_0000022	floor plate
http://purl.obolibrary.org/obo/ZP_0013237	motor neuron abducens motor nucleus amount, abnormal	http://purl.obolibrary.org/obo/ZFA_0009052	motor neuron	http://purl.obolibrary.org/obo/ZFA_0000713	abducens motor nucleus
