defined_class	defined_class_label	anatomical_entity	anatomical_entity_label	location	location_label
http://purl.obolibrary.org/obo/ZP_0101856	multi-ciliated epithelial cell pronephric duct amount, abnormal	http://purl.obolibrary.org/obo/ZFA_0005242	multi-ciliated epithelial cell	http://purl.obolibrary.org/obo/ZFA_0000150	pronephric duct
http://purl.obolibrary.org/obo/ZP_0015216	multi-ciliated epithelial cell pronephros amount, abnormal	http://purl.obolibrary.org/obo/ZFA_0005242	multi-ciliated epithelial cell	http://purl.obolibrary.org/obo/ZFA_0000151	pronephros
http://purl.obolibrary.org/obo/ZP_0013129	muscle cell adductor mandibulae amount, abnormal	http://purl.obolibrary.org/obo/ZFA_0009114	muscle cell	http://purl.obolibrary.org/obo/ZFA_0007049	adductor mandibulae
http://purl.obolibrary.org/obo/ZP_0013133	muscle cell interhyoideus amount, abnormal	http://purl.obolibrary.org/obo/ZFA_0009114	muscle cell	http://purl.obolibrary.org/obo/ZFA_0007051	interhyoideus
http://purl.obolibrary.org/obo/ZP_0013117	muscle cell medial rectus amount, abnormal	http://purl.obolibrary.org/obo/ZFA_0009114	muscle cell	http://purl.obolibrary.org/obo/ZFA_0000301	medial rectus
http://purl.obolibrary.org/obo/ZP_0100818	muscle male organism amount, abnormal	http://purl.obolibrary.org/obo/ZFA_0005145	muscle	http://purl.obolibrary.org/obo/ZFA_0000242	male organism
http://purl.obolibrary.org/obo/ZP_0103300	muscle pioneer horizontal myoseptum amount, abnormal	http://purl.obolibrary.org/obo/ZFA_0001086	muscle pioneer	http://purl.obolibrary.org/obo/ZFA_0000671	horizontal myoseptum
http://purl.obolibrary.org/obo/ZP_0022317	myelin sheath posterior lateral line nerve amount, abnormal	http://purl.obolibrary.org/obo/GO_0043209	myelin sheath	http://purl.obolibrary.org/obo/ZFA_0000175	posterior lateral line nerve
http://purl.obolibrary.org/obo/ZP_0101084	myelin sheath spinal cord amount, abnormal	http://purl.obolibrary.org/obo/GO_0043209	myelin sheath	http://purl.obolibrary.org/obo/ZFA_0000075	spinal cord
http://purl.obolibrary.org/obo/ZP_0022311	myelinating Schwann cell posterior lateral line amount, abnormal	http://purl.obolibrary.org/obo/ZFA_0009135	myelinating Schwann cell	http://purl.obolibrary.org/obo/ZFA_0000944	posterior lateral line
http://purl.obolibrary.org/obo/ZP_0021668	myeloid leukocyte head kidney amount, abnormal	http://purl.obolibrary.org/obo/ZFA_0009326	myeloid leukocyte	http://purl.obolibrary.org/obo/ZFA_0000669	head kidney
http://purl.obolibrary.org/obo/ZP_0013704	myoblast adductor hyomandibulae amount, abnormal	http://purl.obolibrary.org/obo/ZFA_0009025	myoblast	http://purl.obolibrary.org/obo/ZFA_0007053	adductor hyomandibulae
http://purl.obolibrary.org/obo/ZP_0013703	myoblast levator arcus palatini amount, abnormal	http://purl.obolibrary.org/obo/ZFA_0009025	myoblast	http://purl.obolibrary.org/obo/ZFA_0000384	levator arcus palatini
http://purl.obolibrary.org/obo/ZP_0012884	myosin filament fast muscle cell amount, abnormal	http://purl.obolibrary.org/obo/GO_0032982	myosin filament	http://purl.obolibrary.org/obo/ZFA_0009117	fast muscle cell
http://purl.obolibrary.org/obo/ZP_0015058	myosin filament slow muscle cell amount, abnormal	http://purl.obolibrary.org/obo/GO_0032982	myosin filament	http://purl.obolibrary.org/obo/ZFA_0009116	slow muscle cell
http://purl.obolibrary.org/obo/ZP_0013114	neuromast anterior lateral line amount, abnormal	http://purl.obolibrary.org/obo/ZFA_0000243	neuromast	http://purl.obolibrary.org/obo/ZFA_0001470	anterior lateral line
http://purl.obolibrary.org/obo/ZP_0102969	neuromast head amount, abnormal	http://purl.obolibrary.org/obo/ZFA_0000243	neuromast	http://purl.obolibrary.org/obo/ZFA_0001114	head
http://purl.obolibrary.org/obo/ZP_0022744	neuron diencephalon amount, abnormal	http://purl.obolibrary.org/obo/ZFA_0009248	neuron	http://purl.obolibrary.org/obo/ZFA_0000101	diencephalon
http://purl.obolibrary.org/obo/ZP_0017089	neuron dorsal root ganglion amount, abnormal	http://purl.obolibrary.org/obo/ZFA_0009248	neuron	http://purl.obolibrary.org/obo/ZFA_0000200	dorsal root ganglion
http://purl.obolibrary.org/obo/ZP_0014158	neuron enteric nervous system amount, abnormal	http://purl.obolibrary.org/obo/ZFA_0009248	neuron	http://purl.obolibrary.org/obo/ZFA_0001155	enteric nervous system
http://purl.obolibrary.org/obo/ZP_0101905	neuron projection facial nerve motor nucleus amount, abnormal	http://purl.obolibrary.org/obo/GO_0043005	neuron projection	http://purl.obolibrary.org/obo/ZFA_0000206	facial nerve motor nucleus
http://purl.obolibrary.org/obo/ZP_0013851	neuron spinal cord amount, abnormal	http://purl.obolibrary.org/obo/ZFA_0009248	neuron	http://purl.obolibrary.org/obo/ZFA_0000075	spinal cord
http://purl.obolibrary.org/obo/ZP_0022037	neuron telencephalon amount, abnormal	http://purl.obolibrary.org/obo/ZFA_0009248	neuron	http://purl.obolibrary.org/obo/ZFA_0000079	telencephalon
http://purl.obolibrary.org/obo/ZP_0018331	neutrophil epithelium amount, abnormal	http://purl.obolibrary.org/obo/ZFA_0009327	neutrophil	http://purl.obolibrary.org/obo/ZFA_0001486	epithelium
http://purl.obolibrary.org/obo/ZP_0021473	neutrophil gill amount, abnormal	http://purl.obolibrary.org/obo/ZFA_0009327	neutrophil	http://purl.obolibrary.org/obo/ZFA_0000354	gill
http://purl.obolibrary.org/obo/ZP_0104108	neutrophil gut amount, abnormal	http://purl.obolibrary.org/obo/ZFA_0009327	neutrophil	http://purl.obolibrary.org/obo/ZFA_0000112	gut
http://purl.obolibrary.org/obo/ZP_0021476	neutrophil intestine amount, abnormal	http://purl.obolibrary.org/obo/ZFA_0009327	neutrophil	http://purl.obolibrary.org/obo/ZFA_0001338	intestine
http://purl.obolibrary.org/obo/ZP_0022138	neutrophil liver amount, abnormal	http://purl.obolibrary.org/obo/ZFA_0009327	neutrophil	http://purl.obolibrary.org/obo/ZFA_0000123	liver
http://purl.obolibrary.org/obo/ZP_0022133	neutrophil male organism amount, abnormal	http://purl.obolibrary.org/obo/ZFA_0009327	neutrophil	http://purl.obolibrary.org/obo/ZFA_0000242	male organism
http://purl.obolibrary.org/obo/ZP_0102823	neutrophil otic vesicle amount, abnormal	http://purl.obolibrary.org/obo/ZFA_0009327	neutrophil	http://purl.obolibrary.org/obo/ZFA_0000051	otic vesicle
http://purl.obolibrary.org/obo/ZP_0102824	neutrophil post-vent region amount, abnormal	http://purl.obolibrary.org/obo/ZFA_0009327	neutrophil	http://purl.obolibrary.org/obo/ZFA_0001117	post-vent region
http://purl.obolibrary.org/obo/ZP_0103200	neutrophil regenerating fin amount, abnormal	http://purl.obolibrary.org/obo/ZFA_0009327	neutrophil	http://purl.obolibrary.org/obo/ZFA_0001269	regenerating fin
http://purl.obolibrary.org/obo/ZP_0100605	neutrophil whole organism amount, abnormal	http://purl.obolibrary.org/obo/ZFA_0009327	neutrophil	http://purl.obolibrary.org/obo/ZFA_0001094	whole organism
http://purl.obolibrary.org/obo/ZP_0022316	node of Ranvier posterior lateral line nerve amount, abnormal	http://purl.obolibrary.org/obo/GO_0033268	node of Ranvier	http://purl.obolibrary.org/obo/ZFA_0000175	posterior lateral line nerve
http://purl.obolibrary.org/obo/ZP_0013616	nuclear pore skeletal muscle cell amount, abnormal	http://purl.obolibrary.org/obo/GO_0005643	nuclear pore	http://purl.obolibrary.org/obo/ZFA_0009115	skeletal muscle cell
http://purl.obolibrary.org/obo/ZP_0018327	nucleate erythrocyte blood amount, abnormal	http://purl.obolibrary.org/obo/ZFA_0009256	nucleate erythrocyte	http://purl.obolibrary.org/obo/ZFA_0000007	blood
http://purl.obolibrary.org/obo/ZP_0100844	nucleate erythrocyte caudal vein amount, abnormal	http://purl.obolibrary.org/obo/ZFA_0009256	nucleate erythrocyte	http://purl.obolibrary.org/obo/ZFA_0000180	caudal vein
http://purl.obolibrary.org/obo/ZP_0022406	nucleate erythrocyte heart amount, abnormal	http://purl.obolibrary.org/obo/ZFA_0009256	nucleate erythrocyte	http://purl.obolibrary.org/obo/ZFA_0000114	heart
http://purl.obolibrary.org/obo/ZP_0013126	nucleus adductor mandibulae amount, abnormal	http://purl.obolibrary.org/obo/GO_0005634	nucleus	http://purl.obolibrary.org/obo/ZFA_0007049	adductor mandibulae
http://purl.obolibrary.org/obo/ZP_0021717	nucleus brain amount, abnormal	http://purl.obolibrary.org/obo/GO_0005634	nucleus	http://purl.obolibrary.org/obo/ZFA_0000008	brain
http://purl.obolibrary.org/obo/ZP_0102809	nucleus endothelial cell amount, abnormal	http://purl.obolibrary.org/obo/GO_0005634	nucleus	http://purl.obolibrary.org/obo/ZFA_0009065	endothelial cell
http://purl.obolibrary.org/obo/ZP_0013130	nucleus interhyoideus amount, abnormal	http://purl.obolibrary.org/obo/GO_0005634	nucleus	http://purl.obolibrary.org/obo/ZFA_0007051	interhyoideus
http://purl.obolibrary.org/obo/ZP_0021718	nucleus retina amount, abnormal	http://purl.obolibrary.org/obo/GO_0005634	nucleus	http://purl.obolibrary.org/obo/ZFA_0000152	retina
http://purl.obolibrary.org/obo/ZP_0015544	nucleus retinal cone cell amount, abnormal	http://purl.obolibrary.org/obo/GO_0005634	nucleus	http://purl.obolibrary.org/obo/ZFA_0009262	retinal cone cell
http://purl.obolibrary.org/obo/ZP_0015545	nucleus retinal rod cell amount, abnormal	http://purl.obolibrary.org/obo/GO_0005634	nucleus	http://purl.obolibrary.org/obo/ZFA_0009275	retinal rod cell
http://purl.obolibrary.org/obo/ZP_0022565	nucleus somite amount, abnormal	http://purl.obolibrary.org/obo/GO_0005634	nucleus	http://purl.obolibrary.org/obo/ZFA_0000155	somite
http://purl.obolibrary.org/obo/ZP_0022751	oligodendrocyte brain amount, abnormal	http://purl.obolibrary.org/obo/ZFA_0009076	oligodendrocyte	http://purl.obolibrary.org/obo/ZFA_0000008	brain
http://purl.obolibrary.org/obo/ZP_0101055	oligodendrocyte hindbrain amount, abnormal	http://purl.obolibrary.org/obo/ZFA_0009076	oligodendrocyte	http://purl.obolibrary.org/obo/ZFA_0000029	hindbrain
http://purl.obolibrary.org/obo/ZP_0022309	oligodendrocyte spinal cord amount, abnormal	http://purl.obolibrary.org/obo/ZFA_0009076	oligodendrocyte	http://purl.obolibrary.org/obo/ZFA_0000075	spinal cord
http://purl.obolibrary.org/obo/ZP_0021507	osteoblast cranium amount, abnormal	http://purl.obolibrary.org/obo/ZFA_0009031	osteoblast	http://purl.obolibrary.org/obo/ZFA_0000737	cranium
http://purl.obolibrary.org/obo/ZP_0013496	pancreatic B cell primary islet amount, abnormal	http://purl.obolibrary.org/obo/ZFA_0009102	pancreatic B cell	http://purl.obolibrary.org/obo/ZFA_0005754	primary islet
http://purl.obolibrary.org/obo/ZP_0013498	pancreatic B cell secondary islet amount, abnormal	http://purl.obolibrary.org/obo/ZFA_0009102	pancreatic B cell	http://purl.obolibrary.org/obo/ZFA_0005756	secondary islet
http://purl.obolibrary.org/obo/ZP_0015606	photoreceptor cell pineal complex amount, abnormal	http://purl.obolibrary.org/obo/ZFA_0009127	photoreceptor cell	http://purl.obolibrary.org/obo/ZFA_0001359	pineal complex
http://purl.obolibrary.org/obo/ZP_0021879	photoreceptor cell retinal outer nuclear layer amount, abnormal	http://purl.obolibrary.org/obo/ZFA_0009127	photoreceptor cell	http://purl.obolibrary.org/obo/ZFA_0001464	retinal outer nuclear layer
http://purl.obolibrary.org/obo/ZP_0103739	photoreceptor connecting cilium photoreceptor cell amount, abnormal	http://purl.obolibrary.org/obo/GO_0032391	photoreceptor connecting cilium	http://purl.obolibrary.org/obo/ZFA_0009127	photoreceptor cell
http://purl.obolibrary.org/obo/ZP_0103737	photoreceptor outer segment retinal rod cell amount, abnormal	http://purl.obolibrary.org/obo/GO_0001750	photoreceptor outer segment	http://purl.obolibrary.org/obo/ZFA_0009275	retinal rod cell
http://purl.obolibrary.org/obo/ZP_0021693	podocyte foot podocyte amount, abnormal	http://purl.obolibrary.org/obo/GO_0098846	podocyte foot	http://purl.obolibrary.org/obo/ZFA_0009285	podocyte
http://purl.obolibrary.org/obo/ZP_0022585	posterior region hematopoietic system amount, abnormal	http://purl.obolibrary.org/obo/BSPO_0000072	posterior region	http://purl.obolibrary.org/obo/ZFA_0005023	hematopoietic system
http://purl.obolibrary.org/obo/ZP_0021373	posterior region whole organism amount, abnormal	http://purl.obolibrary.org/obo/BSPO_0000072	posterior region	http://purl.obolibrary.org/obo/ZFA_0001094	whole organism
http://purl.obolibrary.org/obo/ZP_0100437	primary motor neuron spinal cord amount, abnormal	http://purl.obolibrary.org/obo/ZFA_0009244	primary motor neuron	http://purl.obolibrary.org/obo/ZFA_0000075	spinal cord
http://purl.obolibrary.org/obo/ZP_0021962	proximal region intestine amount, abnormal	http://purl.obolibrary.org/obo/BSPO_0000077	proximal region	http://purl.obolibrary.org/obo/ZFA_0001338	intestine
http://purl.obolibrary.org/obo/ZP_0101353	regenerating fin caudal fin amount, abnormal	http://purl.obolibrary.org/obo/ZFA_0001269	regenerating fin	http://purl.obolibrary.org/obo/ZFA_0001058	caudal fin
http://purl.obolibrary.org/obo/ZP_0021498	regenerating tissue lateral rectus amount, abnormal	http://purl.obolibrary.org/obo/ZFA_0005147	regenerating tissue	http://purl.obolibrary.org/obo/ZFA_0000383	lateral rectus
http://purl.obolibrary.org/obo/ZP_0100214	retinal cone cell regenerating tissue amount, abnormal	http://purl.obolibrary.org/obo/ZFA_0009262	retinal cone cell	http://purl.obolibrary.org/obo/ZFA_0005147	regenerating tissue
http://purl.obolibrary.org/obo/ZP_0100216	retinal rod cell regenerating tissue amount, abnormal	http://purl.obolibrary.org/obo/ZFA_0009275	retinal rod cell	http://purl.obolibrary.org/obo/ZFA_0005147	regenerating tissue
http://purl.obolibrary.org/obo/ZP_0013758	sensory neuron dorsal root ganglion amount, abnormal	http://purl.obolibrary.org/obo/ZFA_0009053	sensory neuron	http://purl.obolibrary.org/obo/ZFA_0000200	dorsal root ganglion
http://purl.obolibrary.org/obo/ZP_0013446	serotonergic neuron diencephalon amount, abnormal	http://purl.obolibrary.org/obo/ZFA_0009361	serotonergic neuron	http://purl.obolibrary.org/obo/ZFA_0000101	diencephalon
http://purl.obolibrary.org/obo/ZP_0014159	serotonergic neuron enteric nervous system amount, abnormal	http://purl.obolibrary.org/obo/ZFA_0009361	serotonergic neuron	http://purl.obolibrary.org/obo/ZFA_0001155	enteric nervous system
http://purl.obolibrary.org/obo/ZP_0100999	skeletal muscle myofibril skeletal muscle amount, abnormal	http://purl.obolibrary.org/obo/GO_0098723	skeletal muscle myofibril	http://purl.obolibrary.org/obo/ZFA_0005277	skeletal muscle
http://purl.obolibrary.org/obo/ZP_0103490	skeletal muscle myofibril skeletal muscle cell amount, abnormal	http://purl.obolibrary.org/obo/GO_0098723	skeletal muscle myofibril	http://purl.obolibrary.org/obo/ZFA_0009115	skeletal muscle cell
http://purl.obolibrary.org/obo/ZP_0016021	spermatogonium testis amount, abnormal	http://purl.obolibrary.org/obo/ZFA_0009007	spermatogonium	http://purl.obolibrary.org/obo/ZFA_0000598	testis
http://purl.obolibrary.org/obo/ZP_0022550	stereocilium neuromast hair cell amount, abnormal	http://purl.obolibrary.org/obo/GO_0032420	stereocilium	http://purl.obolibrary.org/obo/ZFA_0009367	neuromast hair cell
http://purl.obolibrary.org/obo/ZP_0017505	synapse Mauthner neuron amount, abnormal	http://purl.obolibrary.org/obo/GO_0045202	synapse	http://purl.obolibrary.org/obo/ZFA_0009149	Mauthner neuron
http://purl.obolibrary.org/obo/ZP_0020330	synapse horizontal cell amount, abnormal	http://purl.obolibrary.org/obo/GO_0045202	synapse	http://purl.obolibrary.org/obo/ZFA_0009315	horizontal cell
http://purl.obolibrary.org/obo/ZP_0004566	synaptic vesicle neuromast hair cell amount, abnormal	http://purl.obolibrary.org/obo/GO_0008021	synaptic vesicle	http://purl.obolibrary.org/obo/ZFA_0009367	neuromast hair cell
http://purl.obolibrary.org/obo/ZP_0101700	vascular associated smooth muscle cell dorsal aorta amount, abnormal	http://purl.obolibrary.org/obo/ZFA_0009181	vascular associated smooth muscle cell	http://purl.obolibrary.org/obo/ZFA_0000014	dorsal aorta
http://purl.obolibrary.org/obo/ZP_0104374	vascular sprouts central artery amount, abnormal	http://purl.obolibrary.org/obo/ZFA_0005559	vascular sprouts	http://purl.obolibrary.org/obo/ZFA_0005020	central artery
http://purl.obolibrary.org/obo/ZP_0022820	vascular sprouts intersegmental vein amount, abnormal	http://purl.obolibrary.org/obo/ZFA_0005559	vascular sprouts	http://purl.obolibrary.org/obo/ZFA_0001057	intersegmental vein
http://purl.obolibrary.org/obo/ZP_0022926	vascular sprouts intersegmental vessel amount, abnormal	http://purl.obolibrary.org/obo/ZFA_0005559	vascular sprouts	http://purl.obolibrary.org/obo/ZFA_0001285	intersegmental vessel
http://purl.obolibrary.org/obo/ZP_0102249	vasculature hematopoietic system amount, abnormal	http://purl.obolibrary.org/obo/ZFA_0005249	vasculature	http://purl.obolibrary.org/obo/ZFA_0005023	hematopoietic system
http://purl.obolibrary.org/obo/ZP_0102732	vasculature intestine amount, abnormal	http://purl.obolibrary.org/obo/ZFA_0005249	vasculature	http://purl.obolibrary.org/obo/ZFA_0001338	intestine
http://purl.obolibrary.org/obo/ZP_0101660	ventral region pharyngeal arch amount, abnormal	http://purl.obolibrary.org/obo/BSPO_0000084	ventral region	http://purl.obolibrary.org/obo/ZFA_0001306	pharyngeal arch
http://purl.obolibrary.org/obo/ZP_0100093	ventral region pharyngeal arch cartilage amount, abnormal	http://purl.obolibrary.org/obo/BSPO_0000084	ventral region	http://purl.obolibrary.org/obo/ZFA_0001460	pharyngeal arch cartilage
http://purl.obolibrary.org/obo/ZP_0104504	visceral fat female organism amount, abnormal	http://purl.obolibrary.org/obo/ZFA_0005759	visceral fat	http://purl.obolibrary.org/obo/ZFA_0000303	female organism
