defined_class	defined_class_label	biological_process	biological_process_label	location	location_label
http://purl.obolibrary.org/obo/ZP_0104791	CaP motoneuron decreased occurrence excitatory synapse assembly, abnormal	http://purl.obolibrary.org/obo/GO_1904861	excitatory synapse assembly	http://purl.obolibrary.org/obo/ZFA_0009243	CaP motoneuron
http://purl.obolibrary.org/obo/ZP_0020574	CaP motoneuron decreased occurrence synaptic vesicle exocytosis, abnormal	http://purl.obolibrary.org/obo/GO_0016079	synaptic vesicle exocytosis	http://purl.obolibrary.org/obo/ZFA_0009243	CaP motoneuron
http://purl.obolibrary.org/obo/ZP_0102646	EVL decreased occurrence regulation of embryonic cell shape, abnormal	http://purl.obolibrary.org/obo/GO_0016476	regulation of embryonic cell shape	http://purl.obolibrary.org/obo/ZFA_0000086	EVL
http://purl.obolibrary.org/obo/ZP_0104424	GABAergic neuron decreased occurrence axon arborization, abnormal	http://purl.obolibrary.org/obo/GO_0140060	axon arborization	http://purl.obolibrary.org/obo/ZFA_0009276	GABAergic neuron
http://purl.obolibrary.org/obo/ZP_0104692	GABAergic neuron decreased occurrence http://purl.obolibrary.org/obo/GO_1904862, abnormal	http://purl.obolibrary.org/obo/GO_1904862	inhibitory synapse assembly	http://purl.obolibrary.org/obo/ZFA_0009276	GABAergic neuron
http://purl.obolibrary.org/obo/ZP_0018230	Kupffer's vesicle decreased occurrence detection of nodal flow, abnormal	http://purl.obolibrary.org/obo/GO_0003127	detection of nodal flow	http://purl.obolibrary.org/obo/ZFA_0000001	Kupffer's vesicle
http://purl.obolibrary.org/obo/ZP_0103203	Kupffer's vesicle decreased occurrence motile cilium assembly, abnormal	http://purl.obolibrary.org/obo/GO_0044458	motile cilium assembly	http://purl.obolibrary.org/obo/ZFA_0000001	Kupffer's vesicle
http://purl.obolibrary.org/obo/ZP_0102683	Kupffer's vesicle decreased occurrence tube formation, abnormal	http://purl.obolibrary.org/obo/GO_0035148	tube formation	http://purl.obolibrary.org/obo/ZFA_0000001	Kupffer's vesicle
http://purl.obolibrary.org/obo/ZP_0104280	Mauthner neuron decreased occurrence gap junction assembly, abnormal	http://purl.obolibrary.org/obo/GO_0016264	gap junction assembly	http://purl.obolibrary.org/obo/ZFA_0009149	Mauthner neuron
http://purl.obolibrary.org/obo/ZP_0017979	Mauthner neuron decreased occurrence synaptic transmission, glycinergic, abnormal	http://purl.obolibrary.org/obo/GO_0060012	synaptic transmission, glycinergic	http://purl.obolibrary.org/obo/ZFA_0009149	Mauthner neuron
http://purl.obolibrary.org/obo/ZP_0015182	Muller cell decreased occurrence cell dedifferentiation, abnormal	http://purl.obolibrary.org/obo/GO_0043697	cell dedifferentiation	http://purl.obolibrary.org/obo/ZFA_0009280	Muller cell
http://purl.obolibrary.org/obo/ZP_0010048	Muller cell decreased occurrence cell population proliferation, abnormal	http://purl.obolibrary.org/obo/GO_0008283	cell population proliferation	http://purl.obolibrary.org/obo/ZFA_0009280	Muller cell
http://purl.obolibrary.org/obo/ZP_0020937	RoP motor neuron decreased occurrence axon development, abnormal	http://purl.obolibrary.org/obo/GO_0061564	axon development	http://purl.obolibrary.org/obo/ZFA_0005180	RoP motor neuron
http://purl.obolibrary.org/obo/ZP_0011862	Rohon-Beard neuron decreased occurrence anterograde axonal transport, abnormal	http://purl.obolibrary.org/obo/GO_0008089	anterograde axonal transport	http://purl.obolibrary.org/obo/ZFA_0009150	Rohon-Beard neuron
http://purl.obolibrary.org/obo/ZP_0011865	Rohon-Beard neuron decreased occurrence collateral sprouting, abnormal	http://purl.obolibrary.org/obo/GO_0048668	collateral sprouting	http://purl.obolibrary.org/obo/ZFA_0009150	Rohon-Beard neuron
http://purl.obolibrary.org/obo/ZP_0011867	Rohon-Beard neuron decreased occurrence retrograde transport, endosome to plasma membrane, abnormal	http://purl.obolibrary.org/obo/GO_1990126	retrograde transport, endosome to plasma membrane	http://purl.obolibrary.org/obo/ZFA_0009150	Rohon-Beard neuron
http://purl.obolibrary.org/obo/ZP_0104086	T cell decreased occurrence cell maturation, abnormal	http://purl.obolibrary.org/obo/GO_0048469	cell maturation	http://purl.obolibrary.org/obo/ZFA_0009046	T cell
http://purl.obolibrary.org/obo/ZP_0012064	adenohypophysis decreased occurrence corticotropin hormone secreting cell differentiation, abnormal	http://purl.obolibrary.org/obo/GO_0060128	corticotropin hormone secreting cell differentiation	http://purl.obolibrary.org/obo/ZFA_0001282	adenohypophysis
http://purl.obolibrary.org/obo/ZP_0102295	afferent neuron decreased occurrence synapse assembly, abnormal	http://purl.obolibrary.org/obo/GO_0007416	synapse assembly	http://purl.obolibrary.org/obo/ZFA_0009238	afferent neuron
http://purl.obolibrary.org/obo/ZP_0021110	anterior commissure decreased occurrence central nervous system projection neuron axonogenesis, abnormal	http://purl.obolibrary.org/obo/GO_0021952	central nervous system projection neuron axonogenesis	http://purl.obolibrary.org/obo/ZFA_0001108	anterior commissure
http://purl.obolibrary.org/obo/ZP_0018508	aortic arch 1 decreased occurrence cell migration involved in heart development, abnormal	http://purl.obolibrary.org/obo/GO_0060973	cell migration involved in heart development	http://purl.obolibrary.org/obo/ZFA_0005005	aortic arch 1
http://purl.obolibrary.org/obo/ZP_0020874	aortic arch 3 decreased occurrence blood vessel lumenization, abnormal	http://purl.obolibrary.org/obo/GO_0072554	blood vessel lumenization	http://purl.obolibrary.org/obo/ZFA_0005007	aortic arch 3
http://purl.obolibrary.org/obo/ZP_0020873	aortic arch 4 decreased occurrence blood vessel lumenization, abnormal	http://purl.obolibrary.org/obo/GO_0072554	blood vessel lumenization	http://purl.obolibrary.org/obo/ZFA_0005008	aortic arch 4
http://purl.obolibrary.org/obo/ZP_0020253	aortic arch 5 decreased occurrence blood vessel lumenization, abnormal	http://purl.obolibrary.org/obo/GO_0072554	blood vessel lumenization	http://purl.obolibrary.org/obo/ZFA_0005009	aortic arch 5
http://purl.obolibrary.org/obo/ZP_0020247	aortic arch 6 decreased occurrence blood vessel lumenization, abnormal	http://purl.obolibrary.org/obo/GO_0072554	blood vessel lumenization	http://purl.obolibrary.org/obo/ZFA_0005016	aortic arch 6
http://purl.obolibrary.org/obo/ZP_0021225	atrioventricular canal decreased occurrence Notch signaling pathway, abnormal	http://purl.obolibrary.org/obo/GO_0007219	Notch signaling pathway	http://purl.obolibrary.org/obo/ZFA_0001315	atrioventricular canal
http://purl.obolibrary.org/obo/ZP_0022627	atrioventricular canal decreased occurrence Wnt signaling pathway, abnormal	http://purl.obolibrary.org/obo/GO_0016055	Wnt signaling pathway	http://purl.obolibrary.org/obo/ZFA_0001315	atrioventricular canal
http://purl.obolibrary.org/obo/ZP_0101413	bile ductule decreased occurrence morphogenesis of a branching epithelium, abnormal	http://purl.obolibrary.org/obo/GO_0061138	morphogenesis of a branching epithelium	http://purl.obolibrary.org/obo/ZFA_0005164	bile ductule
http://purl.obolibrary.org/obo/ZP_0017220	blastema decreased occurrence cell population proliferation, abnormal	http://purl.obolibrary.org/obo/GO_0008283	cell population proliferation	http://purl.obolibrary.org/obo/ZFA_0001270	blastema
http://purl.obolibrary.org/obo/ZP_0021434	blastema decreased occurrence mitotic cell cycle, abnormal	http://purl.obolibrary.org/obo/GO_0000278	mitotic cell cycle	http://purl.obolibrary.org/obo/ZFA_0001270	blastema
http://purl.obolibrary.org/obo/ZP_0019128	blood cell decreased occurrence DNA methylation, abnormal	http://purl.obolibrary.org/obo/GO_0006306	DNA methylation	http://purl.obolibrary.org/obo/ZFA_0009044	blood cell
http://purl.obolibrary.org/obo/ZP_0020629	brain decreased occurrence apoptotic cell clearance, abnormal	http://purl.obolibrary.org/obo/GO_0043277	apoptotic cell clearance	http://purl.obolibrary.org/obo/ZFA_0000008	brain
http://purl.obolibrary.org/obo/ZP_0022968	brain decreased occurrence apoptotic process, abnormal	http://purl.obolibrary.org/obo/GO_0006915	apoptotic process	http://purl.obolibrary.org/obo/ZFA_0000008	brain
http://purl.obolibrary.org/obo/ZP_0007651	brain decreased occurrence branching morphogenesis of a nerve, abnormal	http://purl.obolibrary.org/obo/GO_0048755	branching morphogenesis of a nerve	http://purl.obolibrary.org/obo/ZFA_0000008	brain
http://purl.obolibrary.org/obo/ZP_0008589	brain decreased occurrence cell population proliferation, abnormal	http://purl.obolibrary.org/obo/GO_0008283	cell population proliferation	http://purl.obolibrary.org/obo/ZFA_0000008	brain
http://purl.obolibrary.org/obo/ZP_0101272	brain decreased occurrence dopamine secretion, abnormal	http://purl.obolibrary.org/obo/GO_0014046	dopamine secretion	http://purl.obolibrary.org/obo/ZFA_0000008	brain
http://purl.obolibrary.org/obo/ZP_0102128	brain decreased occurrence endothelial cell development, abnormal	http://purl.obolibrary.org/obo/GO_0001885	endothelial cell development	http://purl.obolibrary.org/obo/ZFA_0000008	brain
http://purl.obolibrary.org/obo/ZP_0101454	brain decreased occurrence gamma-aminobutyric acid signaling pathway, abnormal	http://purl.obolibrary.org/obo/GO_0007214	gamma-aminobutyric acid signaling pathway	http://purl.obolibrary.org/obo/ZFA_0000008	brain
http://purl.obolibrary.org/obo/ZP_0104774	brain decreased occurrence http://purl.obolibrary.org/obo/GO_0007263, abnormal	http://purl.obolibrary.org/obo/GO_0007263	nitric oxide mediated signal transduction	http://purl.obolibrary.org/obo/ZFA_0000008	brain
http://purl.obolibrary.org/obo/ZP_0021490	brain decreased occurrence macrophage chemotaxis, abnormal	http://purl.obolibrary.org/obo/GO_0048246	macrophage chemotaxis	http://purl.obolibrary.org/obo/ZFA_0000008	brain
http://purl.obolibrary.org/obo/ZP_0018174	brain decreased occurrence neural precursor cell proliferation, abnormal	http://purl.obolibrary.org/obo/GO_0061351	neural precursor cell proliferation	http://purl.obolibrary.org/obo/ZFA_0000008	brain
http://purl.obolibrary.org/obo/ZP_0018101	brain decreased occurrence neuron differentiation, abnormal	http://purl.obolibrary.org/obo/GO_0030182	neuron differentiation	http://purl.obolibrary.org/obo/ZFA_0000008	brain
http://purl.obolibrary.org/obo/ZP_0021101	brain decreased occurrence oligodendrocyte development, abnormal	http://purl.obolibrary.org/obo/GO_0014003	oligodendrocyte development	http://purl.obolibrary.org/obo/ZFA_0000008	brain
http://purl.obolibrary.org/obo/ZP_0016919	branchiomotor neuron decreased occurrence neuron migration, abnormal	http://purl.obolibrary.org/obo/GO_0001764	neuron migration	http://purl.obolibrary.org/obo/ZFA_0005731	branchiomotor neuron
http://purl.obolibrary.org/obo/ZP_0022993	cardiac muscle cell decreased occurrence apical constriction, abnormal	http://purl.obolibrary.org/obo/GO_0003383	apical constriction	http://purl.obolibrary.org/obo/ZFA_0009316	cardiac muscle cell
http://purl.obolibrary.org/obo/ZP_0022983	cardiac muscle cell decreased occurrence cell population proliferation, abnormal	http://purl.obolibrary.org/obo/GO_0008283	cell population proliferation	http://purl.obolibrary.org/obo/ZFA_0009316	cardiac muscle cell
http://purl.obolibrary.org/obo/ZP_0022063	cardiac ventricle decreased occurrence cardiac muscle cell proliferation, abnormal	http://purl.obolibrary.org/obo/GO_0060038	cardiac muscle cell proliferation	http://purl.obolibrary.org/obo/ZFA_0000009	cardiac ventricle
http://purl.obolibrary.org/obo/ZP_0101976	cardiac ventricle decreased occurrence cardiac muscle tissue regeneration, abnormal	http://purl.obolibrary.org/obo/GO_0061026	cardiac muscle tissue regeneration	http://purl.obolibrary.org/obo/ZFA_0000009	cardiac ventricle
http://purl.obolibrary.org/obo/ZP_0103830	caudal fin decreased occurrence blood circulation, abnormal	http://purl.obolibrary.org/obo/GO_0008015	blood circulation	http://purl.obolibrary.org/obo/ZFA_0001058	caudal fin
http://purl.obolibrary.org/obo/ZP_0019622	caudal fin decreased occurrence bone mineralization, abnormal	http://purl.obolibrary.org/obo/GO_0030282	bone mineralization	http://purl.obolibrary.org/obo/ZFA_0001058	caudal fin
http://purl.obolibrary.org/obo/ZP_0021616	caudal fin decreased occurrence reactive oxygen species biosynthetic process, abnormal	http://purl.obolibrary.org/obo/GO_1903409	reactive oxygen species biosynthetic process	http://purl.obolibrary.org/obo/ZFA_0001058	caudal fin
http://purl.obolibrary.org/obo/ZP_0102745	caudal hematopoietic tissue decreased occurrence hematopoietic stem cell proliferation, abnormal	http://purl.obolibrary.org/obo/GO_0071425	hematopoietic stem cell proliferation	http://purl.obolibrary.org/obo/ZFA_0005898	caudal hematopoietic tissue
http://purl.obolibrary.org/obo/ZP_0008658	caudal vein plexus decreased occurrence blood circulation, abnormal	http://purl.obolibrary.org/obo/GO_0008015	blood circulation	http://purl.obolibrary.org/obo/ZFA_0001286	caudal vein plexus
http://purl.obolibrary.org/obo/ZP_0104237	caudal vein plexus decreased occurrence sprouting angiogenesis, abnormal	http://purl.obolibrary.org/obo/GO_0002040	sprouting angiogenesis	http://purl.obolibrary.org/obo/ZFA_0001286	caudal vein plexus
http://purl.obolibrary.org/obo/ZP_0104329	central canal decreased occurrence detection of mechanical stimulus, abnormal	http://purl.obolibrary.org/obo/GO_0050982	detection of mechanical stimulus	http://purl.obolibrary.org/obo/ZFA_0000938	central canal
http://purl.obolibrary.org/obo/ZP_0012616	centrum decreased occurrence bone mineralization, abnormal	http://purl.obolibrary.org/obo/GO_0030282	bone mineralization	http://purl.obolibrary.org/obo/ZFA_0000126	centrum
http://purl.obolibrary.org/obo/ZP_0012619	ceratohyal bone decreased occurrence bone mineralization, abnormal	http://purl.obolibrary.org/obo/GO_0030282	bone mineralization	http://purl.obolibrary.org/obo/ZFA_0000578	ceratohyal bone
http://purl.obolibrary.org/obo/ZP_0018112	cerebellum decreased occurrence cell proliferation in hindbrain, abnormal	http://purl.obolibrary.org/obo/GO_0021534	cell proliferation in hindbrain	http://purl.obolibrary.org/obo/ZFA_0000100	cerebellum
http://purl.obolibrary.org/obo/ZP_0020385	chondrocranium cartilage decreased occurrence neural crest cell migration, abnormal	http://purl.obolibrary.org/obo/GO_0001755	neural crest cell migration	http://purl.obolibrary.org/obo/ZFA_0001461	chondrocranium cartilage
http://purl.obolibrary.org/obo/ZP_0102627	chondrocyte decreased occurrence secretion, abnormal	http://purl.obolibrary.org/obo/GO_0046903	secretion	http://purl.obolibrary.org/obo/ZFA_0009084	chondrocyte
http://purl.obolibrary.org/obo/ZP_0018669	ciliated olfactory receptor neuron decreased occurrence olfactory bulb development, abnormal	http://purl.obolibrary.org/obo/GO_0021772	olfactory bulb development	http://purl.obolibrary.org/obo/ZFA_0009358	ciliated olfactory receptor neuron
http://purl.obolibrary.org/obo/ZP_0019681	commissure of the tract of the commissure of the caudal tuberculum decreased occurrence axon extension involved in axon guidance, abnormal	http://purl.obolibrary.org/obo/GO_0048846	axon extension involved in axon guidance	http://purl.obolibrary.org/obo/ZFA_0005877	commissure of the tract of the commissure of the caudal tuberculum
http://purl.obolibrary.org/obo/ZP_0020123	common cardinal vein decreased occurrence angiogenesis, abnormal	http://purl.obolibrary.org/obo/GO_0001525	angiogenesis	http://purl.obolibrary.org/obo/ZFA_0000186	common cardinal vein
http://purl.obolibrary.org/obo/ZP_0020124	common cardinal vein decreased occurrence blood vessel development, abnormal	http://purl.obolibrary.org/obo/GO_0001568	blood vessel development	http://purl.obolibrary.org/obo/ZFA_0000186	common cardinal vein
http://purl.obolibrary.org/obo/ZP_0020118	common cardinal vein decreased occurrence cell population proliferation, abnormal	http://purl.obolibrary.org/obo/GO_0008283	cell population proliferation	http://purl.obolibrary.org/obo/ZFA_0000186	common cardinal vein
http://purl.obolibrary.org/obo/ZP_0016727	compact layer of ventricle decreased occurrence cardiac muscle cell proliferation, abnormal	http://purl.obolibrary.org/obo/GO_0060038	cardiac muscle cell proliferation	http://purl.obolibrary.org/obo/ZFA_0005062	compact layer of ventricle
http://purl.obolibrary.org/obo/ZP_0104151	corpus cerebelli decreased occurrence cerebellar granule cell differentiation, abnormal	http://purl.obolibrary.org/obo/GO_0021707	cerebellar granule cell differentiation	http://purl.obolibrary.org/obo/ZFA_0000188	corpus cerebelli
http://purl.obolibrary.org/obo/ZP_0019846	cranial nerve II decreased occurrence anterograde axonal transport of mitochondrion, abnormal	http://purl.obolibrary.org/obo/GO_0098957	anterograde axonal transport of mitochondrion	http://purl.obolibrary.org/obo/ZFA_0000435	cranial nerve II
http://purl.obolibrary.org/obo/ZP_0019853	cranial nerve II decreased occurrence anterograde trans-synaptic signaling, abnormal	http://purl.obolibrary.org/obo/GO_0098916	anterograde trans-synaptic signaling	http://purl.obolibrary.org/obo/ZFA_0000435	cranial nerve II
http://purl.obolibrary.org/obo/ZP_0019851	cranial nerve II decreased occurrence collateral sprouting, abnormal	http://purl.obolibrary.org/obo/GO_0048668	collateral sprouting	http://purl.obolibrary.org/obo/ZFA_0000435	cranial nerve II
http://purl.obolibrary.org/obo/ZP_0012620	cranium decreased occurrence bone mineralization, abnormal	http://purl.obolibrary.org/obo/GO_0030282	bone mineralization	http://purl.obolibrary.org/obo/ZFA_0000737	cranium
http://purl.obolibrary.org/obo/ZP_0021506	cranium decreased occurrence osteoblast differentiation, abnormal	http://purl.obolibrary.org/obo/GO_0001649	osteoblast differentiation	http://purl.obolibrary.org/obo/ZFA_0000737	cranium
http://purl.obolibrary.org/obo/ZP_0010767	dermatocranium decreased occurrence ossification involved in bone remodeling, abnormal	http://purl.obolibrary.org/obo/GO_0043932	ossification involved in bone remodeling	http://purl.obolibrary.org/obo/ZFA_0000863	dermatocranium
http://purl.obolibrary.org/obo/ZP_0019553	dermatocranium decreased occurrence ossification, abnormal	http://purl.obolibrary.org/obo/GO_0001503	ossification	http://purl.obolibrary.org/obo/ZFA_0000863	dermatocranium
http://purl.obolibrary.org/obo/ZP_0104596	dorsal aorta decreased occurrence sprouting angiogenesis, abnormal	http://purl.obolibrary.org/obo/GO_0002040	sprouting angiogenesis	http://purl.obolibrary.org/obo/ZFA_0000014	dorsal aorta
http://purl.obolibrary.org/obo/ZP_0020913	dorsal longitudinal anastomotic vessel decreased occurrence blood vessel development, abnormal	http://purl.obolibrary.org/obo/GO_0001568	blood vessel development	http://purl.obolibrary.org/obo/ZFA_0005025	dorsal longitudinal anastomotic vessel
http://purl.obolibrary.org/obo/ZP_0103177	dorsal longitudinal anastomotic vessel decreased occurrence blood vessel morphogenesis, abnormal	http://purl.obolibrary.org/obo/GO_0048514	blood vessel morphogenesis	http://purl.obolibrary.org/obo/ZFA_0005025	dorsal longitudinal anastomotic vessel
http://purl.obolibrary.org/obo/ZP_0103388	dorsal root ganglion decreased occurrence peripheral nervous system axon ensheathment, abnormal	http://purl.obolibrary.org/obo/GO_0032292	peripheral nervous system axon ensheathment	http://purl.obolibrary.org/obo/ZFA_0000200	dorsal root ganglion
http://purl.obolibrary.org/obo/ZP_0017542	dorsal telencephalon decreased occurrence neuron projection morphogenesis, abnormal	http://purl.obolibrary.org/obo/GO_0048812	neuron projection morphogenesis	http://purl.obolibrary.org/obo/ZFA_0000505	dorsal telencephalon
http://purl.obolibrary.org/obo/ZP_0102767	endocardial precursor decreased occurrence cardioblast migration to the midline involved in heart field formation, abnormal	http://purl.obolibrary.org/obo/GO_0060975	cardioblast migration to the midline involved in heart field formation	http://purl.obolibrary.org/obo/ZFA_0005489	endocardial precursor
http://purl.obolibrary.org/obo/ZP_0102778	endocardial precursor decreased occurrence fibronectin fibril organization, abnormal	http://purl.obolibrary.org/obo/GO_1905590	fibronectin fibril organization	http://purl.obolibrary.org/obo/ZFA_0005489	endocardial precursor
http://purl.obolibrary.org/obo/ZP_0102642	endochondral bone decreased occurrence bone mineralization, abnormal	http://purl.obolibrary.org/obo/GO_0030282	bone mineralization	http://purl.obolibrary.org/obo/ZFA_0001591	endochondral bone
http://purl.obolibrary.org/obo/ZP_0019548	endochondral bone decreased occurrence ossification, abnormal	http://purl.obolibrary.org/obo/GO_0001503	ossification	http://purl.obolibrary.org/obo/ZFA_0001591	endochondral bone
http://purl.obolibrary.org/obo/ZP_0102779	endoderm decreased occurrence cell migration, abnormal	http://purl.obolibrary.org/obo/GO_0016477	cell migration	http://purl.obolibrary.org/obo/ZFA_0000017	endoderm
http://purl.obolibrary.org/obo/ZP_0103185	endothelial tip cell decreased occurrence cell division, abnormal	http://purl.obolibrary.org/obo/GO_0051301	cell division	http://purl.obolibrary.org/obo/ZFA_0009303	endothelial tip cell
http://purl.obolibrary.org/obo/ZP_0011541	enteric nervous system decreased occurrence cell division, abnormal	http://purl.obolibrary.org/obo/GO_0051301	cell division	http://purl.obolibrary.org/obo/ZFA_0001155	enteric nervous system
http://purl.obolibrary.org/obo/ZP_0021588	enteric neuron decreased occurrence neural crest cell migration involved in autonomic nervous system development, abnormal	http://purl.obolibrary.org/obo/GO_1901166	neural crest cell migration involved in autonomic nervous system development	http://purl.obolibrary.org/obo/ZFA_0005775	enteric neuron
http://purl.obolibrary.org/obo/ZP_0020502	ependymal cell decreased occurrence motile cilium assembly, abnormal	http://purl.obolibrary.org/obo/GO_0044458	motile cilium assembly	http://purl.obolibrary.org/obo/ZFA_0009033	ependymal cell
http://purl.obolibrary.org/obo/ZP_0022007	epicardium decreased occurrence epithelial to mesenchymal transition, abnormal	http://purl.obolibrary.org/obo/GO_0001837	epithelial to mesenchymal transition	http://purl.obolibrary.org/obo/ZFA_0005057	epicardium
http://purl.obolibrary.org/obo/ZP_0102446	erythroblast decreased occurrence mitophagy, abnormal	http://purl.obolibrary.org/obo/GO_0000423	mitophagy	http://purl.obolibrary.org/obo/ZFA_0005237	erythroblast
http://purl.obolibrary.org/obo/ZP_0018693	erythroid lineage cell decreased occurrence myeloid progenitor cell differentiation, abnormal	http://purl.obolibrary.org/obo/GO_0002318	myeloid progenitor cell differentiation	http://purl.obolibrary.org/obo/ZFA_0009325	erythroid lineage cell
http://purl.obolibrary.org/obo/ZP_0008400	ethmoid cartilage decreased occurrence chondrocyte proliferation, abnormal	http://purl.obolibrary.org/obo/GO_0035988	chondrocyte proliferation	http://purl.obolibrary.org/obo/ZFA_0001405	ethmoid cartilage
http://purl.obolibrary.org/obo/ZP_0103266	exocrine pancreas decreased occurrence canonical Wnt signaling pathway, abnormal	http://purl.obolibrary.org/obo/GO_0060070	canonical Wnt signaling pathway	http://purl.obolibrary.org/obo/ZFA_0001249	exocrine pancreas
http://purl.obolibrary.org/obo/ZP_0019629	exocrine pancreas decreased occurrence cell population proliferation, abnormal	http://purl.obolibrary.org/obo/GO_0008283	cell population proliferation	http://purl.obolibrary.org/obo/ZFA_0001249	exocrine pancreas
http://purl.obolibrary.org/obo/ZP_0019626	exocrine pancreas decreased occurrence growth, abnormal	http://purl.obolibrary.org/obo/GO_0040007	growth	http://purl.obolibrary.org/obo/ZFA_0001249	exocrine pancreas
http://purl.obolibrary.org/obo/ZP_0021412	exocrine pancreas decreased occurrence pancreas induction, abnormal	http://purl.obolibrary.org/obo/GO_0061132	pancreas induction	http://purl.obolibrary.org/obo/ZFA_0001249	exocrine pancreas
http://purl.obolibrary.org/obo/ZP_0020567	eye decreased occurrence cell population proliferation, abnormal	http://purl.obolibrary.org/obo/GO_0008283	cell population proliferation	http://purl.obolibrary.org/obo/ZFA_0000107	eye
http://purl.obolibrary.org/obo/ZP_0103601	eye decreased occurrence iridophore differentiation, abnormal	http://purl.obolibrary.org/obo/GO_0050935	iridophore differentiation	http://purl.obolibrary.org/obo/ZFA_0000107	eye
http://purl.obolibrary.org/obo/ZP_0021060	facial lymphatic vessel decreased occurrence lymphangiogenesis, abnormal	http://purl.obolibrary.org/obo/GO_0001946	lymphangiogenesis	http://purl.obolibrary.org/obo/ZFA_0005108	facial lymphatic vessel
http://purl.obolibrary.org/obo/ZP_0100537	facial nerve motor nucleus decreased occurrence motor neuron migration, abnormal	http://purl.obolibrary.org/obo/GO_0097475	motor neuron migration	http://purl.obolibrary.org/obo/ZFA_0000206	facial nerve motor nucleus
http://purl.obolibrary.org/obo/ZP_0011734	facial placode decreased occurrence neurogenesis, abnormal	http://purl.obolibrary.org/obo/GO_0022008	neurogenesis	http://purl.obolibrary.org/obo/ZFA_0001295	facial placode
http://purl.obolibrary.org/obo/ZP_0101843	fast muscle cell decreased occurrence innervation, abnormal	http://purl.obolibrary.org/obo/GO_0060384	innervation	http://purl.obolibrary.org/obo/ZFA_0009117	fast muscle cell
http://purl.obolibrary.org/obo/ZP_0101846	fast muscle cell decreased occurrence neuromuscular junction development, skeletal muscle fiber, abnormal	http://purl.obolibrary.org/obo/GO_0098529	neuromuscular junction development, skeletal muscle fiber	http://purl.obolibrary.org/obo/ZFA_0009117	fast muscle cell
http://purl.obolibrary.org/obo/ZP_0018658	forerunner cell group decreased occurrence cell population proliferation, abnormal	http://purl.obolibrary.org/obo/GO_0008283	cell population proliferation	http://purl.obolibrary.org/obo/ZFA_0000023	forerunner cell group
