defined_class	defined_class_label	biological_process	biological_process_label	location	location_label
http://purl.obolibrary.org/obo/ZP_0018536	spinal cord decreased occurrence axon ensheathment in central nervous system, abnormal	http://purl.obolibrary.org/obo/GO_0032291	axon ensheathment in central nervous system	http://purl.obolibrary.org/obo/ZFA_0000075	spinal cord
http://purl.obolibrary.org/obo/ZP_0014476	spinal cord decreased occurrence axon extension involved in regeneration, abnormal	http://purl.obolibrary.org/obo/GO_0048677	axon extension involved in regeneration	http://purl.obolibrary.org/obo/ZFA_0000075	spinal cord
http://purl.obolibrary.org/obo/ZP_0022761	spinal cord decreased occurrence axon regeneration, abnormal	http://purl.obolibrary.org/obo/GO_0031103	axon regeneration	http://purl.obolibrary.org/obo/ZFA_0000075	spinal cord
http://purl.obolibrary.org/obo/ZP_0018531	spinal cord decreased occurrence central nervous system myelination, abnormal	http://purl.obolibrary.org/obo/GO_0022010	central nervous system myelination	http://purl.obolibrary.org/obo/ZFA_0000075	spinal cord
http://purl.obolibrary.org/obo/ZP_0104338	spinal cord decreased occurrence cerebrospinal fluid circulation, abnormal	http://purl.obolibrary.org/obo/GO_0090660	cerebrospinal fluid circulation	http://purl.obolibrary.org/obo/ZFA_0000075	spinal cord
http://purl.obolibrary.org/obo/ZP_0104337	spinal cord decreased occurrence epithelial cilium movement, abnormal	http://purl.obolibrary.org/obo/GO_0003351	epithelial cilium movement involved in extracellular fluid movement	http://purl.obolibrary.org/obo/ZFA_0000075	spinal cord
http://purl.obolibrary.org/obo/ZP_0101083	spinal cord decreased occurrence gliogenesis, abnormal	http://purl.obolibrary.org/obo/GO_0042063	gliogenesis	http://purl.obolibrary.org/obo/ZFA_0000075	spinal cord
http://purl.obolibrary.org/obo/ZP_0018534	spinal cord decreased occurrence oligodendrocyte development, abnormal	http://purl.obolibrary.org/obo/GO_0014003	oligodendrocyte development	http://purl.obolibrary.org/obo/ZFA_0000075	spinal cord
http://purl.obolibrary.org/obo/ZP_0104279	spinal cord interneuron decreased occurrence gap junction assembly, abnormal	http://purl.obolibrary.org/obo/GO_0016264	gap junction assembly	http://purl.obolibrary.org/obo/ZFA_0000778	spinal cord interneuron
http://purl.obolibrary.org/obo/ZP_0022764	statoacoustic (VIII) ganglion decreased occurrence neuroblast proliferation, abnormal	http://purl.obolibrary.org/obo/GO_0007405	neuroblast proliferation	http://purl.obolibrary.org/obo/ZFA_0000588	statoacoustic (VIII) ganglion
http://purl.obolibrary.org/obo/ZP_0017814	statoacoustic (VIII) ganglion decreased occurrence neuron differentiation, abnormal	http://purl.obolibrary.org/obo/GO_0030182	neuron differentiation	http://purl.obolibrary.org/obo/ZFA_0000588	statoacoustic (VIII) ganglion
http://purl.obolibrary.org/obo/ZP_0021111	supraoptic tract decreased occurrence central nervous system projection neuron axonogenesis, abnormal	http://purl.obolibrary.org/obo/GO_0021952	central nervous system projection neuron axonogenesis	http://purl.obolibrary.org/obo/ZFA_0001657	supraoptic tract
http://purl.obolibrary.org/obo/ZP_0103596	swim bladder decreased occurrence surfactant homeostasis, abnormal	http://purl.obolibrary.org/obo/GO_0043129	surfactant homeostasis	http://purl.obolibrary.org/obo/ZFA_0000076	swim bladder
http://purl.obolibrary.org/obo/ZP_0101750	telencephalon decreased occurrence cell population proliferation, abnormal	http://purl.obolibrary.org/obo/GO_0008283	cell population proliferation	http://purl.obolibrary.org/obo/ZFA_0000079	telencephalon
http://purl.obolibrary.org/obo/ZP_0101751	telencephalon decreased occurrence commitment of multipotent stem cells to neuronal lineage in forebrain, abnormal	http://purl.obolibrary.org/obo/GO_0021898	commitment of multipotent stem cells to neuronal lineage in forebrain	http://purl.obolibrary.org/obo/ZFA_0000079	telencephalon
http://purl.obolibrary.org/obo/ZP_0020900	testis decreased occurrence cell population proliferation, abnormal	http://purl.obolibrary.org/obo/GO_0008283	cell population proliferation	http://purl.obolibrary.org/obo/ZFA_0000598	testis
http://purl.obolibrary.org/obo/ZP_0009055	testis decreased occurrence telomere maintenance, abnormal	http://purl.obolibrary.org/obo/GO_0000723	telomere maintenance	http://purl.obolibrary.org/obo/ZFA_0000598	testis
http://purl.obolibrary.org/obo/ZP_0019378	thoracic duct decreased occurrence lymph vessel development, abnormal	http://purl.obolibrary.org/obo/GO_0001945	lymph vessel development	http://purl.obolibrary.org/obo/ZFA_0005110	thoracic duct
http://purl.obolibrary.org/obo/ZP_0100318	thoracic duct decreased occurrence lymphangiogenesis, abnormal	http://purl.obolibrary.org/obo/GO_0001946	lymphangiogenesis	http://purl.obolibrary.org/obo/ZFA_0005110	thoracic duct
http://purl.obolibrary.org/obo/ZP_0102063	thromboblast decreased occurrence cell population proliferation, abnormal	http://purl.obolibrary.org/obo/GO_0008283	cell population proliferation	http://purl.obolibrary.org/obo/ZFA_0009351	thromboblast
http://purl.obolibrary.org/obo/ZP_0102059	thrombocyte decreased occurrence cell population proliferation, abnormal	http://purl.obolibrary.org/obo/GO_0008283	cell population proliferation	http://purl.obolibrary.org/obo/ZFA_0009323	thrombocyte
http://purl.obolibrary.org/obo/ZP_0002300	thymus decreased occurrence cell population proliferation, abnormal	http://purl.obolibrary.org/obo/GO_0008283	cell population proliferation	http://purl.obolibrary.org/obo/ZFA_0001078	thymus
http://purl.obolibrary.org/obo/ZP_0019743	thymus decreased occurrence hematopoietic stem cell migration, abnormal	http://purl.obolibrary.org/obo/GO_0035701	hematopoietic stem cell migration	http://purl.obolibrary.org/obo/ZFA_0001078	thymus
http://purl.obolibrary.org/obo/ZP_0011860	trigeminal ganglion decreased occurrence collateral sprouting, abnormal	http://purl.obolibrary.org/obo/GO_0048668	collateral sprouting	http://purl.obolibrary.org/obo/ZFA_0000295	trigeminal ganglion
http://purl.obolibrary.org/obo/ZP_0012313	trigeminal sensory neuron decreased occurrence extracellular matrix disassembly, abnormal	http://purl.obolibrary.org/obo/GO_0022617	extracellular matrix disassembly	http://purl.obolibrary.org/obo/ZFA_0005768	trigeminal sensory neuron
http://purl.obolibrary.org/obo/ZP_0011262	trunk decreased occurrence blood circulation, abnormal	http://purl.obolibrary.org/obo/GO_0008015	blood circulation	http://purl.obolibrary.org/obo/ZFA_0001115	trunk
http://purl.obolibrary.org/obo/ZP_0020691	trunk decreased occurrence cell population proliferation, abnormal	http://purl.obolibrary.org/obo/GO_0008283	cell population proliferation	http://purl.obolibrary.org/obo/ZFA_0001115	trunk
http://purl.obolibrary.org/obo/ZP_0104243	trunk decreased occurrence startle response, abnormal	http://purl.obolibrary.org/obo/GO_0001964	startle response	http://purl.obolibrary.org/obo/ZFA_0001115	trunk
http://purl.obolibrary.org/obo/ZP_0104245	trunk decreased occurrence thigmotaxis, abnormal	http://purl.obolibrary.org/obo/GO_0001966	thigmotaxis	http://purl.obolibrary.org/obo/ZFA_0001115	trunk
http://purl.obolibrary.org/obo/ZP_0021756	trunk vasculature decreased occurrence angiogenesis, abnormal	http://purl.obolibrary.org/obo/GO_0001525	angiogenesis	http://purl.obolibrary.org/obo/ZFA_0005024	trunk vasculature
http://purl.obolibrary.org/obo/ZP_0018581	trunk vasculature decreased occurrence blood circulation, abnormal	http://purl.obolibrary.org/obo/GO_0008015	blood circulation	http://purl.obolibrary.org/obo/ZFA_0005024	trunk vasculature
http://purl.obolibrary.org/obo/ZP_0011738	vagal placode 1 decreased occurrence neurogenesis, abnormal	http://purl.obolibrary.org/obo/GO_0022008	neurogenesis	http://purl.obolibrary.org/obo/ZFA_0001297	vagal placode 1
http://purl.obolibrary.org/obo/ZP_0011740	vagal placode 2 decreased occurrence neurogenesis, abnormal	http://purl.obolibrary.org/obo/GO_0022008	neurogenesis	http://purl.obolibrary.org/obo/ZFA_0001298	vagal placode 2
http://purl.obolibrary.org/obo/ZP_0011742	vagal placode 3 decreased occurrence neurogenesis, abnormal	http://purl.obolibrary.org/obo/GO_0022008	neurogenesis	http://purl.obolibrary.org/obo/ZFA_0001299	vagal placode 3
http://purl.obolibrary.org/obo/ZP_0011744	vagal placode 4 decreased occurrence neurogenesis, abnormal	http://purl.obolibrary.org/obo/GO_0022008	neurogenesis	http://purl.obolibrary.org/obo/ZFA_0001300	vagal placode 4
http://purl.obolibrary.org/obo/ZP_0100317	vascular lymphangioblast decreased occurrence lymphangiogenesis, abnormal	http://purl.obolibrary.org/obo/GO_0001946	lymphangiogenesis	http://purl.obolibrary.org/obo/ZFA_0009395	vascular lymphangioblast
http://purl.obolibrary.org/obo/ZP_0102604	ventral mandibular arch decreased occurrence Wnt signaling pathway, abnormal	http://purl.obolibrary.org/obo/GO_0016055	Wnt signaling pathway	http://purl.obolibrary.org/obo/ZFA_0001273	ventral mandibular arch
http://purl.obolibrary.org/obo/ZP_0102190	ventral wall of dorsal aorta decreased occurrence cell population proliferation, abnormal	http://purl.obolibrary.org/obo/GO_0008283	cell population proliferation	http://purl.obolibrary.org/obo/ZFA_0005028	ventral wall of dorsal aorta
http://purl.obolibrary.org/obo/ZP_0102403	ventral wall of dorsal aorta decreased occurrence macrophage migration, abnormal	http://purl.obolibrary.org/obo/GO_1905517	macrophage migration	http://purl.obolibrary.org/obo/ZFA_0005028	ventral wall of dorsal aorta
http://purl.obolibrary.org/obo/ZP_0008031	ventricular myocardium decreased occurrence cardiac chamber ballooning, abnormal	http://purl.obolibrary.org/obo/GO_0003242	cardiac chamber ballooning	http://purl.obolibrary.org/obo/ZFA_0005061	ventricular myocardium
http://purl.obolibrary.org/obo/ZP_0022655	ventricular system decreased occurrence macrophage migration, abnormal	http://purl.obolibrary.org/obo/GO_1905517	macrophage migration	http://purl.obolibrary.org/obo/ZFA_0001261	ventricular system
http://purl.obolibrary.org/obo/ZP_0019623	vertebra decreased occurrence bone mineralization, abnormal	http://purl.obolibrary.org/obo/GO_0030282	bone mineralization	http://purl.obolibrary.org/obo/ZFA_0001189	vertebra
http://purl.obolibrary.org/obo/ZP_0104196	vertebra decreased occurrence ossification, abnormal	http://purl.obolibrary.org/obo/GO_0001503	ossification	http://purl.obolibrary.org/obo/ZFA_0001189	vertebra
http://purl.obolibrary.org/obo/ZP_0021360	whole organism decreased occurrence TOR signaling, abnormal	http://purl.obolibrary.org/obo/GO_0031929	TOR signaling	http://purl.obolibrary.org/obo/ZFA_0001094	whole organism
http://purl.obolibrary.org/obo/ZP_0102020	whole organism decreased occurrence apoptotic process, abnormal	http://purl.obolibrary.org/obo/GO_0006915	apoptotic process	http://purl.obolibrary.org/obo/ZFA_0001094	whole organism
http://purl.obolibrary.org/obo/ZP_0001340	whole organism decreased occurrence cell cycle phase transition, abnormal	http://purl.obolibrary.org/obo/GO_0044770	cell cycle phase transition	http://purl.obolibrary.org/obo/ZFA_0001094	whole organism
http://purl.obolibrary.org/obo/ZP_0103915	whole organism decreased occurrence cell population proliferation, abnormal	http://purl.obolibrary.org/obo/GO_0008283	cell population proliferation	http://purl.obolibrary.org/obo/ZFA_0001094	whole organism
http://purl.obolibrary.org/obo/ZP_0021359	whole organism decreased occurrence cholesterol biosynthetic process, abnormal	http://purl.obolibrary.org/obo/GO_0006695	cholesterol biosynthetic process	http://purl.obolibrary.org/obo/ZFA_0001094	whole organism
http://purl.obolibrary.org/obo/ZP_0104348	whole organism decreased occurrence double-strand break repair, abnormal	http://purl.obolibrary.org/obo/GO_0006302	double-strand break repair	http://purl.obolibrary.org/obo/ZFA_0001094	whole organism
http://purl.obolibrary.org/obo/ZP_0014475	whole organism decreased occurrence swimming, abnormal	http://purl.obolibrary.org/obo/GO_0036268	swimming	http://purl.obolibrary.org/obo/ZFA_0001094	whole organism
