defined_class	defined_class_label	biological_process	biological_process_label	location	location_label
http://purl.obolibrary.org/obo/ZP_0103475	optic tectum decreased occurrence neuron projection development, abnormal	http://purl.obolibrary.org/obo/GO_0031175	neuron projection development	http://purl.obolibrary.org/obo/ZFA_0000445	optic tectum
http://purl.obolibrary.org/obo/ZP_0102588	otic vesicle decreased occurrence cell population proliferation, abnormal	http://purl.obolibrary.org/obo/GO_0008283	cell population proliferation	http://purl.obolibrary.org/obo/ZFA_0000051	otic vesicle
http://purl.obolibrary.org/obo/ZP_0019609	otic vesicle decreased occurrence epithelial to mesenchymal transition, abnormal	http://purl.obolibrary.org/obo/GO_0001837	epithelial to mesenchymal transition	http://purl.obolibrary.org/obo/ZFA_0000051	otic vesicle
http://purl.obolibrary.org/obo/ZP_0019615	otic vesicle decreased occurrence neuroblast delamination, abnormal	http://purl.obolibrary.org/obo/GO_0060234	neuroblast delamination	http://purl.obolibrary.org/obo/ZFA_0000051	otic vesicle
http://purl.obolibrary.org/obo/ZP_0017734	otic vesicle decreased occurrence neuroblast fate specification, abnormal	http://purl.obolibrary.org/obo/GO_0014018	neuroblast fate specification	http://purl.obolibrary.org/obo/ZFA_0000051	otic vesicle
http://purl.obolibrary.org/obo/ZP_0020365	otic vesicle decreased occurrence neuroblast proliferation, abnormal	http://purl.obolibrary.org/obo/GO_0007405	neuroblast proliferation	http://purl.obolibrary.org/obo/ZFA_0000051	otic vesicle
http://purl.obolibrary.org/obo/ZP_0017735	otic vesicle decreased occurrence neurogenesis, abnormal	http://purl.obolibrary.org/obo/GO_0022008	neurogenesis	http://purl.obolibrary.org/obo/ZFA_0000051	otic vesicle
http://purl.obolibrary.org/obo/ZP_0019230	pancreas decreased occurrence determination of pancreatic left/right asymmetry, abnormal	http://purl.obolibrary.org/obo/GO_0035469	determination of pancreatic left/right asymmetry	http://purl.obolibrary.org/obo/ZFA_0000140	pancreas
http://purl.obolibrary.org/obo/ZP_0102574	pancreas decreased occurrence pancreatic A cell differentiation, abnormal	http://purl.obolibrary.org/obo/GO_0003310	pancreatic A cell differentiation	http://purl.obolibrary.org/obo/ZFA_0000140	pancreas
http://purl.obolibrary.org/obo/ZP_0102044	pancreatic A cell decreased occurrence regeneration, abnormal	http://purl.obolibrary.org/obo/GO_0031099	regeneration	http://purl.obolibrary.org/obo/ZFA_0009104	pancreatic A cell
http://purl.obolibrary.org/obo/ZP_0100513	pancreatic B cell decreased occurrence cell population proliferation, abnormal	http://purl.obolibrary.org/obo/GO_0008283	cell population proliferation	http://purl.obolibrary.org/obo/ZFA_0009102	pancreatic B cell
http://purl.obolibrary.org/obo/ZP_0020938	parachordal vessel decreased occurrence angiogenesis, abnormal	http://purl.obolibrary.org/obo/GO_0001525	angiogenesis	http://purl.obolibrary.org/obo/ZFA_0005034	parachordal vessel
http://purl.obolibrary.org/obo/ZP_0019392	parachordal vessel decreased occurrence vasculature development, abnormal	http://purl.obolibrary.org/obo/GO_0001944	vasculature development	http://purl.obolibrary.org/obo/ZFA_0005034	parachordal vessel
http://purl.obolibrary.org/obo/ZP_0020854	parapineal organ decreased occurrence neuron fate specification, abnormal	http://purl.obolibrary.org/obo/GO_0048665	neuron fate specification	http://purl.obolibrary.org/obo/ZFA_0001360	parapineal organ
http://purl.obolibrary.org/obo/ZP_0012754	pectoral fin bud decreased occurrence cell population proliferation, abnormal	http://purl.obolibrary.org/obo/GO_0008283	cell population proliferation	http://purl.obolibrary.org/obo/ZFA_0000141	pectoral fin bud
http://purl.obolibrary.org/obo/ZP_0102643	perichondral bone decreased occurrence bone mineralization, abnormal	http://purl.obolibrary.org/obo/GO_0030282	bone mineralization	http://purl.obolibrary.org/obo/ZFA_0001630	perichondral bone
http://purl.obolibrary.org/obo/ZP_0019418	pericyte decreased occurrence cell development, abnormal	http://purl.obolibrary.org/obo/GO_0048468	cell development	http://purl.obolibrary.org/obo/ZFA_0009112	pericyte
http://purl.obolibrary.org/obo/ZP_0020459	pharyngeal arch 1 decreased occurrence cell population proliferation, abnormal	http://purl.obolibrary.org/obo/GO_0008283	cell population proliferation	http://purl.obolibrary.org/obo/ZFA_0001612	pharyngeal arch 1
http://purl.obolibrary.org/obo/ZP_0020465	pharyngeal arch 2 decreased occurrence cell population proliferation, abnormal	http://purl.obolibrary.org/obo/GO_0008283	cell population proliferation	http://purl.obolibrary.org/obo/ZFA_0001611	pharyngeal arch 2
http://purl.obolibrary.org/obo/ZP_0018941	pharyngeal arch 3-7 decreased occurrence cell population proliferation, abnormal	http://purl.obolibrary.org/obo/GO_0008283	cell population proliferation	http://purl.obolibrary.org/obo/ZFA_0001613	pharyngeal arch 3-7
http://purl.obolibrary.org/obo/ZP_0102439	pharyngeal arch cartilage decreased occurrence chondrocyte differentiation, abnormal	http://purl.obolibrary.org/obo/GO_0002062	chondrocyte differentiation	http://purl.obolibrary.org/obo/ZFA_0001460	pharyngeal arch cartilage
http://purl.obolibrary.org/obo/ZP_0021130	pharyngeal arch decreased occurrence Wnt protein secretion, abnormal	http://purl.obolibrary.org/obo/GO_0061355	Wnt protein secretion	http://purl.obolibrary.org/obo/ZFA_0001306	pharyngeal arch
http://purl.obolibrary.org/obo/ZP_0008415	pharyngeal arch decreased occurrence cell population proliferation, abnormal	http://purl.obolibrary.org/obo/GO_0008283	cell population proliferation	http://purl.obolibrary.org/obo/ZFA_0001306	pharyngeal arch
http://purl.obolibrary.org/obo/ZP_0012519	pharyngeal pouch decreased occurrence apical protein localization, abnormal	http://purl.obolibrary.org/obo/GO_0045176	apical protein localization	http://purl.obolibrary.org/obo/ZFA_0001106	pharyngeal pouch
http://purl.obolibrary.org/obo/ZP_0102789	pharyngeal pouch decreased occurrence neural crest cell migration, abnormal	http://purl.obolibrary.org/obo/GO_0001755	neural crest cell migration	http://purl.obolibrary.org/obo/ZFA_0001106	pharyngeal pouch
http://purl.obolibrary.org/obo/ZP_0017029	pharyngeal pouch decreased occurrence protein localization to cell junction, abnormal	http://purl.obolibrary.org/obo/GO_1902414	protein localization to cell junction	http://purl.obolibrary.org/obo/ZFA_0001106	pharyngeal pouch
http://purl.obolibrary.org/obo/ZP_0011317	pharyngeal pouch decreased occurrence protein localization to plasma membrane, abnormal	http://purl.obolibrary.org/obo/GO_0072659	protein localization to plasma membrane	http://purl.obolibrary.org/obo/ZFA_0001106	pharyngeal pouch
http://purl.obolibrary.org/obo/ZP_0012405	pharyngeal vasculature decreased occurrence blood vessel endothelial cell differentiation, abnormal	http://purl.obolibrary.org/obo/GO_0060837	blood vessel endothelial cell differentiation	http://purl.obolibrary.org/obo/ZFA_0005003	pharyngeal vasculature
http://purl.obolibrary.org/obo/ZP_0103536	pineal complex decreased occurrence cell differentiation, abnormal	http://purl.obolibrary.org/obo/GO_0030154	cell differentiation	http://purl.obolibrary.org/obo/ZFA_0001359	pineal complex
http://purl.obolibrary.org/obo/ZP_0020297	pineal complex decreased occurrence photoreceptor cell fate specification, abnormal	http://purl.obolibrary.org/obo/GO_0043704	photoreceptor cell fate specification	http://purl.obolibrary.org/obo/ZFA_0001359	pineal complex
http://purl.obolibrary.org/obo/ZP_0103537	pinealocyte decreased occurrence cell differentiation, abnormal	http://purl.obolibrary.org/obo/GO_0030154	cell differentiation	http://purl.obolibrary.org/obo/ZFA_0009284	pinealocyte
http://purl.obolibrary.org/obo/ZP_0012456	posterior intestine decreased occurrence peristalsis, abnormal	http://purl.obolibrary.org/obo/GO_0030432	peristalsis	http://purl.obolibrary.org/obo/ZFA_0000706	posterior intestine
http://purl.obolibrary.org/obo/ZP_0015650	posterior lateral line decreased occurrence myelination in peripheral nervous system, abnormal	http://purl.obolibrary.org/obo/GO_0022011	myelination in peripheral nervous system	http://purl.obolibrary.org/obo/ZFA_0000944	posterior lateral line
http://purl.obolibrary.org/obo/ZP_0017651	posterior lateral line decreased occurrence myelination of posterior lateral line nerve axons, abnormal	http://purl.obolibrary.org/obo/GO_0048932	myelination of posterior lateral line nerve axons	http://purl.obolibrary.org/obo/ZFA_0000944	posterior lateral line
http://purl.obolibrary.org/obo/ZP_0101797	posterior lateral line nerve decreased occurrence anterograde axonal transport of mitochondrion, abnormal	http://purl.obolibrary.org/obo/GO_0098957	anterograde axonal transport of mitochondrion	http://purl.obolibrary.org/obo/ZFA_0000175	posterior lateral line nerve
http://purl.obolibrary.org/obo/ZP_0101780	posterior lateral line nerve decreased occurrence retrograde axonal transport of mitochondrion, abnormal	http://purl.obolibrary.org/obo/GO_0098958	retrograde axonal transport of mitochondrion	http://purl.obolibrary.org/obo/ZFA_0000175	posterior lateral line nerve
http://purl.obolibrary.org/obo/ZP_0101796	posterior lateral line nerve decreased occurrence retrograde axonal transport, abnormal	http://purl.obolibrary.org/obo/GO_0008090	retrograde axonal transport	http://purl.obolibrary.org/obo/ZFA_0000175	posterior lateral line nerve
http://purl.obolibrary.org/obo/ZP_0103196	posterior lateral line neuromast decreased occurrence innervation, abnormal	http://purl.obolibrary.org/obo/GO_0060384	innervation	http://purl.obolibrary.org/obo/ZFA_0000940	posterior lateral line neuromast
http://purl.obolibrary.org/obo/ZP_0104551	posterior lateral line neuromast decreased occurrence synapse assembly, abnormal	http://purl.obolibrary.org/obo/GO_0007416	synapse assembly	http://purl.obolibrary.org/obo/ZFA_0000940	posterior lateral line neuromast
http://purl.obolibrary.org/obo/ZP_0018149	posterior lateral line primordium decreased occurrence cell population proliferation, abnormal	http://purl.obolibrary.org/obo/GO_0008283	cell population proliferation	http://purl.obolibrary.org/obo/ZFA_0001157	posterior lateral line primordium
http://purl.obolibrary.org/obo/ZP_0021107	postoptic commissure decreased occurrence central nervous system projection neuron axonogenesis, abnormal	http://purl.obolibrary.org/obo/GO_0021952	central nervous system projection neuron axonogenesis	http://purl.obolibrary.org/obo/ZFA_0000059	postoptic commissure
http://purl.obolibrary.org/obo/ZP_0014799	primary motor neuron decreased occurrence axon extension, abnormal	http://purl.obolibrary.org/obo/GO_0048675	axon extension	http://purl.obolibrary.org/obo/ZFA_0009244	primary motor neuron
http://purl.obolibrary.org/obo/ZP_0014795	primary motor neuron decreased occurrence spinal cord motor neuron cell fate specification, abnormal	http://purl.obolibrary.org/obo/GO_0021520	spinal cord motor neuron cell fate specification	http://purl.obolibrary.org/obo/ZFA_0009244	primary motor neuron
http://purl.obolibrary.org/obo/ZP_0022022	primitive heart tube decreased occurrence BMP signaling pathway, abnormal	http://purl.obolibrary.org/obo/GO_0030509	BMP signaling pathway	http://purl.obolibrary.org/obo/ZFA_0000149	primitive heart tube
http://purl.obolibrary.org/obo/ZP_0101913	primordial germ cell decreased occurrence actin filament polymerization, abnormal	http://purl.obolibrary.org/obo/GO_0030041	actin filament polymerization	http://purl.obolibrary.org/obo/ZFA_0009288	primordial germ cell
http://purl.obolibrary.org/obo/ZP_0103991	primordial germ cell decreased occurrence cell migration, abnormal	http://purl.obolibrary.org/obo/GO_0016477	cell migration	http://purl.obolibrary.org/obo/ZFA_0009288	primordial germ cell
http://purl.obolibrary.org/obo/ZP_0005348	primordial germ cell decreased occurrence cell motility, abnormal	http://purl.obolibrary.org/obo/GO_0048870	cell motility	http://purl.obolibrary.org/obo/ZFA_0009288	primordial germ cell
http://purl.obolibrary.org/obo/ZP_0100313	primordial germ cell decreased occurrence establishment of cell polarity, abnormal	http://purl.obolibrary.org/obo/GO_0030010	establishment of cell polarity	http://purl.obolibrary.org/obo/ZFA_0009288	primordial germ cell
http://purl.obolibrary.org/obo/ZP_0020114	primordial hindbrain channel decreased occurrence blood vessel development, abnormal	http://purl.obolibrary.org/obo/GO_0001568	blood vessel development	http://purl.obolibrary.org/obo/ZFA_0001052	primordial hindbrain channel
http://purl.obolibrary.org/obo/ZP_0020115	primordial hindbrain channel decreased occurrence cell migration involved in sprouting angiogenesis, abnormal	http://purl.obolibrary.org/obo/GO_0002042	cell migration involved in sprouting angiogenesis	http://purl.obolibrary.org/obo/ZFA_0001052	primordial hindbrain channel
http://purl.obolibrary.org/obo/ZP_0019381	primordial hindbrain channel decreased occurrence vasculature development, abnormal	http://purl.obolibrary.org/obo/GO_0001944	vasculature development	http://purl.obolibrary.org/obo/ZFA_0001052	primordial hindbrain channel
http://purl.obolibrary.org/obo/ZP_0100017	pronephric duct decreased occurrence autophagy, abnormal	http://purl.obolibrary.org/obo/GO_0006914	autophagy	http://purl.obolibrary.org/obo/ZFA_0000150	pronephric duct
http://purl.obolibrary.org/obo/ZP_0018552	pronephric duct decreased occurrence cilium assembly, abnormal	http://purl.obolibrary.org/obo/GO_0060271	cilium assembly	http://purl.obolibrary.org/obo/ZFA_0000150	pronephric duct
http://purl.obolibrary.org/obo/ZP_0018721	pronephric duct decreased occurrence outer dynein arm assembly, abnormal	http://purl.obolibrary.org/obo/GO_0036158	outer dynein arm assembly	http://purl.obolibrary.org/obo/ZFA_0000150	pronephric duct
http://purl.obolibrary.org/obo/ZP_0017413	pronephric proximal convoluted tubule decreased occurrence endocytosis, abnormal	http://purl.obolibrary.org/obo/GO_0006897	endocytosis	http://purl.obolibrary.org/obo/ZFA_0001620	pronephric proximal convoluted tubule
http://purl.obolibrary.org/obo/ZP_0100352	pronephric tubule decreased occurrence cell population proliferation, abnormal	http://purl.obolibrary.org/obo/GO_0008283	cell population proliferation	http://purl.obolibrary.org/obo/ZFA_0001558	pronephric tubule
http://purl.obolibrary.org/obo/ZP_0017411	pronephric tubule decreased occurrence establishment of epithelial cell apical/basal polarity, abnormal	http://purl.obolibrary.org/obo/GO_0045198	establishment of epithelial cell apical/basal polarity	http://purl.obolibrary.org/obo/ZFA_0001558	pronephric tubule
http://purl.obolibrary.org/obo/ZP_0015941	pronephros decreased occurrence establishment of epithelial cell apical/basal polarity, abnormal	http://purl.obolibrary.org/obo/GO_0045198	establishment of epithelial cell apical/basal polarity	http://purl.obolibrary.org/obo/ZFA_0000151	pronephros
http://purl.obolibrary.org/obo/ZP_0019273	pronephros decreased occurrence multi-ciliated epithelial cell differentiation, abnormal	http://purl.obolibrary.org/obo/GO_1903251	multi-ciliated epithelial cell differentiation	http://purl.obolibrary.org/obo/ZFA_0000151	pronephros
http://purl.obolibrary.org/obo/ZP_0102536	pronephros decreased occurrence renal filtration, abnormal	http://purl.obolibrary.org/obo/GO_0097205	renal filtration	http://purl.obolibrary.org/obo/ZFA_0000151	pronephros
http://purl.obolibrary.org/obo/ZP_0103497	regenerating fin decreased occurrence MAPK cascade, abnormal	http://purl.obolibrary.org/obo/GO_0000165	MAPK cascade	http://purl.obolibrary.org/obo/ZFA_0001269	regenerating fin
http://purl.obolibrary.org/obo/ZP_0101341	regenerating fin decreased occurrence blood vessel remodeling, abnormal	http://purl.obolibrary.org/obo/GO_0001974	blood vessel remodeling	http://purl.obolibrary.org/obo/ZFA_0001269	regenerating fin
http://purl.obolibrary.org/obo/ZP_0022549	regenerating fin decreased occurrence bone mineralization, abnormal	http://purl.obolibrary.org/obo/GO_0030282	bone mineralization	http://purl.obolibrary.org/obo/ZFA_0001269	regenerating fin
http://purl.obolibrary.org/obo/ZP_0020687	regenerating fin decreased occurrence cell population proliferation, abnormal	http://purl.obolibrary.org/obo/GO_0008283	cell population proliferation	http://purl.obolibrary.org/obo/ZFA_0001269	regenerating fin
http://purl.obolibrary.org/obo/ZP_0101346	regenerating fin decreased occurrence endothelial cell proliferation, abnormal	http://purl.obolibrary.org/obo/GO_0001935	endothelial cell proliferation	http://purl.obolibrary.org/obo/ZFA_0001269	regenerating fin
http://purl.obolibrary.org/obo/ZP_0104483	regenerating fin decreased occurrence lysosomal lumen acidification, abnormal	http://purl.obolibrary.org/obo/GO_0007042	lysosomal lumen acidification	http://purl.obolibrary.org/obo/ZFA_0001269	regenerating fin
http://purl.obolibrary.org/obo/ZP_0021433	regenerating fin decreased occurrence mitotic cell cycle, abnormal	http://purl.obolibrary.org/obo/GO_0000278	mitotic cell cycle	http://purl.obolibrary.org/obo/ZFA_0001269	regenerating fin
http://purl.obolibrary.org/obo/ZP_0021575	regenerating tissue decreased occurrence angiogenesis, abnormal	http://purl.obolibrary.org/obo/GO_0001525	angiogenesis	http://purl.obolibrary.org/obo/ZFA_0005147	regenerating tissue
http://purl.obolibrary.org/obo/ZP_0022984	regenerating tissue decreased occurrence cardiac muscle cell proliferation, abnormal	http://purl.obolibrary.org/obo/GO_0060038	cardiac muscle cell proliferation	http://purl.obolibrary.org/obo/ZFA_0005147	regenerating tissue
http://purl.obolibrary.org/obo/ZP_0021872	regenerating tissue decreased occurrence cell population proliferation, abnormal	http://purl.obolibrary.org/obo/GO_0008283	cell population proliferation	http://purl.obolibrary.org/obo/ZFA_0005147	regenerating tissue
http://purl.obolibrary.org/obo/ZP_0022985	regenerating tissue decreased occurrence coronary vasculature development, abnormal	http://purl.obolibrary.org/obo/GO_0060976	coronary vasculature development	http://purl.obolibrary.org/obo/ZFA_0005147	regenerating tissue
http://purl.obolibrary.org/obo/ZP_0022008	regenerating tissue decreased occurrence epithelial to mesenchymal transition, abnormal	http://purl.obolibrary.org/obo/GO_0001837	epithelial to mesenchymal transition	http://purl.obolibrary.org/obo/ZFA_0005147	regenerating tissue
http://purl.obolibrary.org/obo/ZP_0101426	regenerating tissue decreased occurrence hepatocyte differentiation, abnormal	http://purl.obolibrary.org/obo/GO_0070365	hepatocyte differentiation	http://purl.obolibrary.org/obo/ZFA_0005147	regenerating tissue
http://purl.obolibrary.org/obo/ZP_0103526	region of the nucleus of the medial longitudinal fascicle decreased occurrence axon regeneration, abnormal	http://purl.obolibrary.org/obo/GO_0031103	axon regeneration	http://purl.obolibrary.org/obo/ZFA_0005871	region of the nucleus of the medial longitudinal fascicle
http://purl.obolibrary.org/obo/ZP_0101821	retina decreased occurrence Notch signaling pathway, abnormal	http://purl.obolibrary.org/obo/GO_0007219	Notch signaling pathway	http://purl.obolibrary.org/obo/ZFA_0000152	retina
http://purl.obolibrary.org/obo/ZP_0103999	retina decreased occurrence cell division, abnormal	http://purl.obolibrary.org/obo/GO_0051301	cell division	http://purl.obolibrary.org/obo/ZFA_0000152	retina
http://purl.obolibrary.org/obo/ZP_0014441	retina decreased occurrence cell population proliferation, abnormal	http://purl.obolibrary.org/obo/GO_0008283	cell population proliferation	http://purl.obolibrary.org/obo/ZFA_0000152	retina
http://purl.obolibrary.org/obo/ZP_0101916	retina decreased occurrence cell proliferation involved in compound eye morphogenesis, abnormal	http://purl.obolibrary.org/obo/GO_0035736	cell proliferation involved in compound eye morphogenesis	http://purl.obolibrary.org/obo/ZFA_0000152	retina
http://purl.obolibrary.org/obo/ZP_0020009	retina decreased occurrence mitotic cell cycle, abnormal	http://purl.obolibrary.org/obo/GO_0000278	mitotic cell cycle	http://purl.obolibrary.org/obo/ZFA_0000152	retina
http://purl.obolibrary.org/obo/ZP_0015424	retina decreased occurrence neuron migration, abnormal	http://purl.obolibrary.org/obo/GO_0001764	neuron migration	http://purl.obolibrary.org/obo/ZFA_0000152	retina
http://purl.obolibrary.org/obo/ZP_0014590	retina decreased occurrence sensory epithelium regeneration, abnormal	http://purl.obolibrary.org/obo/GO_0070654	sensory epithelium regeneration	http://purl.obolibrary.org/obo/ZFA_0000152	retina
http://purl.obolibrary.org/obo/ZP_0014591	retina decreased occurrence stem cell proliferation, abnormal	http://purl.obolibrary.org/obo/GO_0072089	stem cell proliferation	http://purl.obolibrary.org/obo/ZFA_0000152	retina
http://purl.obolibrary.org/obo/ZP_0100210	retinal cone cell decreased occurrence regeneration, abnormal	http://purl.obolibrary.org/obo/GO_0031099	regeneration	http://purl.obolibrary.org/obo/ZFA_0009262	retinal cone cell
http://purl.obolibrary.org/obo/ZP_0019845	retinal ganglion cell decreased occurrence anterograde axonal transport of mitochondrion, abnormal	http://purl.obolibrary.org/obo/GO_0098957	anterograde axonal transport of mitochondrion	http://purl.obolibrary.org/obo/ZFA_0009310	retinal ganglion cell
http://purl.obolibrary.org/obo/ZP_0022351	retinal ganglion cell decreased occurrence axon regeneration, abnormal	http://purl.obolibrary.org/obo/GO_0031103	axon regeneration	http://purl.obolibrary.org/obo/ZFA_0009310	retinal ganglion cell
http://purl.obolibrary.org/obo/ZP_0103573	retinal ganglion cell decreased occurrence cell morphogenesis involved in neuron differentiation, abnormal	http://purl.obolibrary.org/obo/GO_0048667	cell morphogenesis involved in neuron differentiation	http://purl.obolibrary.org/obo/ZFA_0009310	retinal ganglion cell
http://purl.obolibrary.org/obo/ZP_0012400	retinal ganglion cell decreased occurrence dendrite morphogenesis, abnormal	http://purl.obolibrary.org/obo/GO_0048813	dendrite morphogenesis	http://purl.obolibrary.org/obo/ZFA_0009310	retinal ganglion cell
http://purl.obolibrary.org/obo/ZP_0022696	retinal inner plexiform layer decreased occurrence retina layer formation, abnormal	http://purl.obolibrary.org/obo/GO_0010842	retina layer formation	http://purl.obolibrary.org/obo/ZFA_0001329	retinal inner plexiform layer
http://purl.obolibrary.org/obo/ZP_0017836	retinal neural layer decreased occurrence sensory epithelium regeneration, abnormal	http://purl.obolibrary.org/obo/GO_0070654	sensory epithelium regeneration	http://purl.obolibrary.org/obo/ZFA_0000046	retinal neural layer
http://purl.obolibrary.org/obo/ZP_0018630	retinal outer plexiform layer decreased occurrence synapse assembly, abnormal	http://purl.obolibrary.org/obo/GO_0007416	synapse assembly	http://purl.obolibrary.org/obo/ZFA_0001330	retinal outer plexiform layer
http://purl.obolibrary.org/obo/ZP_0100211	retinal rod cell decreased occurrence regeneration, abnormal	http://purl.obolibrary.org/obo/GO_0031099	regeneration	http://purl.obolibrary.org/obo/ZFA_0009275	retinal rod cell
http://purl.obolibrary.org/obo/ZP_0102614	retroarticular decreased occurrence cell population proliferation, abnormal	http://purl.obolibrary.org/obo/GO_0008283	cell population proliferation	http://purl.obolibrary.org/obo/ZFA_0000422	retroarticular
http://purl.obolibrary.org/obo/ZP_0021306	scale decreased occurrence ossification involved in bone remodeling, abnormal	http://purl.obolibrary.org/obo/GO_0043932	ossification involved in bone remodeling	http://purl.obolibrary.org/obo/ZFA_0000277	scale
http://purl.obolibrary.org/obo/ZP_0021930	scale decreased occurrence osteoclast differentiation, abnormal	http://purl.obolibrary.org/obo/GO_0030316	osteoclast differentiation	http://purl.obolibrary.org/obo/ZFA_0000277	scale
http://purl.obolibrary.org/obo/ZP_0014802	secondary motor neuron decreased occurrence axon extension, abnormal	http://purl.obolibrary.org/obo/GO_0048675	axon extension	http://purl.obolibrary.org/obo/ZFA_0009247	secondary motor neuron
http://purl.obolibrary.org/obo/ZP_0101039	skeletal muscle decreased occurrence skeletal muscle tissue regeneration, abnormal	http://purl.obolibrary.org/obo/GO_0043403	skeletal muscle tissue regeneration	http://purl.obolibrary.org/obo/ZFA_0005277	skeletal muscle
http://purl.obolibrary.org/obo/ZP_0100129	skeletal muscle decreased occurrence skeletal myofibril assembly, abnormal	http://purl.obolibrary.org/obo/GO_0014866	skeletal myofibril assembly	http://purl.obolibrary.org/obo/ZFA_0005277	skeletal muscle
http://purl.obolibrary.org/obo/ZP_0101742	smooth muscle cell decreased occurrence cell maturation, abnormal	http://purl.obolibrary.org/obo/GO_0048469	cell maturation	http://purl.obolibrary.org/obo/ZFA_0009118	smooth muscle cell
http://purl.obolibrary.org/obo/ZP_0009008	solid lens vesicle decreased occurrence apoptotic process, abnormal	http://purl.obolibrary.org/obo/GO_0006915	apoptotic process	http://purl.obolibrary.org/obo/ZFA_0001679	solid lens vesicle
http://purl.obolibrary.org/obo/ZP_0101717	somatic cell decreased occurrence cell population proliferation, abnormal	http://purl.obolibrary.org/obo/GO_0008283	cell population proliferation	http://purl.obolibrary.org/obo/ZFA_0009386	somatic cell
http://purl.obolibrary.org/obo/ZP_0102542	somite border decreased occurrence mesenchymal to epithelial transition, abnormal	http://purl.obolibrary.org/obo/GO_0060231	mesenchymal to epithelial transition	http://purl.obolibrary.org/obo/ZFA_0001462	somite border
http://purl.obolibrary.org/obo/ZP_0006177	somite decreased occurrence cell population proliferation, abnormal	http://purl.obolibrary.org/obo/GO_0008283	cell population proliferation	http://purl.obolibrary.org/obo/ZFA_0000155	somite
