defined_class	defined_class_label	biological_process	biological_process_label	location	location_label
http://purl.obolibrary.org/obo/ZP_0102612	fourth ventricle decreased occurrence monocyte chemotaxis, abnormal	http://purl.obolibrary.org/obo/GO_0002548	monocyte chemotaxis	http://purl.obolibrary.org/obo/ZFA_0000110	fourth ventricle
http://purl.obolibrary.org/obo/ZP_0101716	germ line cell decreased occurrence cell population proliferation, abnormal	http://purl.obolibrary.org/obo/GO_0008283	cell population proliferation	http://purl.obolibrary.org/obo/ZFA_0009016	germ line cell
http://purl.obolibrary.org/obo/ZP_0021515	glioblast (sensu Vertebrata) decreased occurrence cell migration in hindbrain, abnormal	http://purl.obolibrary.org/obo/GO_0021535	cell migration in hindbrain	http://purl.obolibrary.org/obo/ZFA_0009169	glioblast (sensu Vertebrata)
http://purl.obolibrary.org/obo/ZP_0011736	glossopharyngeal placode decreased occurrence neurogenesis, abnormal	http://purl.obolibrary.org/obo/GO_0022008	neurogenesis	http://purl.obolibrary.org/obo/ZFA_0001296	glossopharyngeal placode
http://purl.obolibrary.org/obo/ZP_0101715	gonad decreased occurrence cell population proliferation, abnormal	http://purl.obolibrary.org/obo/GO_0008283	cell population proliferation	http://purl.obolibrary.org/obo/ZFA_0000413	gonad
http://purl.obolibrary.org/obo/ZP_0104152	granular eminence decreased occurrence cerebellar granule cell differentiation, abnormal	http://purl.obolibrary.org/obo/GO_0021707	cerebellar granule cell differentiation	http://purl.obolibrary.org/obo/ZFA_0000212	granular eminence
http://purl.obolibrary.org/obo/ZP_0021986	gut decreased occurrence angiogenesis, abnormal	http://purl.obolibrary.org/obo/GO_0001525	angiogenesis	http://purl.obolibrary.org/obo/ZFA_0000112	gut
http://purl.obolibrary.org/obo/ZP_0020907	gut decreased occurrence cell population proliferation, abnormal	http://purl.obolibrary.org/obo/GO_0008283	cell population proliferation	http://purl.obolibrary.org/obo/ZFA_0000112	gut
http://purl.obolibrary.org/obo/ZP_0104653	gut decreased occurrence determination of digestive tract left/right asymmetry, abnormal	http://purl.obolibrary.org/obo/GO_0071907	determination of digestive tract left/right asymmetry	http://purl.obolibrary.org/obo/ZFA_0000112	gut
http://purl.obolibrary.org/obo/ZP_0101731	gut decreased occurrence peristalsis, abnormal	http://purl.obolibrary.org/obo/GO_0030432	peristalsis	http://purl.obolibrary.org/obo/ZFA_0000112	gut
http://purl.obolibrary.org/obo/ZP_0020692	head decreased occurrence cell population proliferation, abnormal	http://purl.obolibrary.org/obo/GO_0008283	cell population proliferation	http://purl.obolibrary.org/obo/ZFA_0001114	head
http://purl.obolibrary.org/obo/ZP_0020906	head kidney decreased occurrence cell population proliferation, abnormal	http://purl.obolibrary.org/obo/GO_0008283	cell population proliferation	http://purl.obolibrary.org/obo/ZFA_0000669	head kidney
http://purl.obolibrary.org/obo/ZP_0101463	heart decreased occurrence cardiac muscle cell proliferation, abnormal	http://purl.obolibrary.org/obo/GO_0060038	cardiac muscle cell proliferation	http://purl.obolibrary.org/obo/ZFA_0000114	heart
http://purl.obolibrary.org/obo/ZP_0104126	heart decreased occurrence cell population proliferation, abnormal	http://purl.obolibrary.org/obo/GO_0008283	cell population proliferation	http://purl.obolibrary.org/obo/ZFA_0000114	heart
http://purl.obolibrary.org/obo/ZP_0019196	heart decreased occurrence heart looping, abnormal	http://purl.obolibrary.org/obo/GO_0001947	heart looping	http://purl.obolibrary.org/obo/ZFA_0000114	heart
http://purl.obolibrary.org/obo/ZP_0104725	heart decreased occurrence tube formation, abnormal	http://purl.obolibrary.org/obo/GO_0035148	tube formation	http://purl.obolibrary.org/obo/ZFA_0000114	heart
http://purl.obolibrary.org/obo/ZP_0022030	heart primordium decreased occurrence BMP signaling pathway, abnormal	http://purl.obolibrary.org/obo/GO_0030509	BMP signaling pathway	http://purl.obolibrary.org/obo/ZFA_0000028	heart primordium
http://purl.obolibrary.org/obo/ZP_0008594	heart primordium decreased occurrence cell population proliferation, abnormal	http://purl.obolibrary.org/obo/GO_0008283	cell population proliferation	http://purl.obolibrary.org/obo/ZFA_0000028	heart primordium
http://purl.obolibrary.org/obo/ZP_0022028	heart rudiment decreased occurrence BMP signaling pathway, abnormal	http://purl.obolibrary.org/obo/GO_0030509	BMP signaling pathway	http://purl.obolibrary.org/obo/ZFA_0000115	heart rudiment
http://purl.obolibrary.org/obo/ZP_0022031	heart tube decreased occurrence BMP signaling pathway, abnormal	http://purl.obolibrary.org/obo/GO_0030509	BMP signaling pathway	http://purl.obolibrary.org/obo/ZFA_0000360	heart tube
http://purl.obolibrary.org/obo/ZP_0019239	heart tube decreased occurrence heart jogging, abnormal	http://purl.obolibrary.org/obo/GO_0003146	heart jogging	http://purl.obolibrary.org/obo/ZFA_0000360	heart tube
http://purl.obolibrary.org/obo/ZP_0104613	hematopoietic cell decreased occurrence blood circulation, abnormal	http://purl.obolibrary.org/obo/GO_0008015	blood circulation	http://purl.obolibrary.org/obo/ZFA_0005830	hematopoietic cell
http://purl.obolibrary.org/obo/ZP_0022433	hematopoietic multipotent progenitor cell decreased occurrence DNA methylation, abnormal	http://purl.obolibrary.org/obo/GO_0006306	DNA methylation	http://purl.obolibrary.org/obo/ZFA_0009354	hematopoietic multipotent progenitor cell
http://purl.obolibrary.org/obo/ZP_0020828	hematopoietic multipotent progenitor cell decreased occurrence cell population proliferation, abnormal	http://purl.obolibrary.org/obo/GO_0008283	cell population proliferation	http://purl.obolibrary.org/obo/ZFA_0009354	hematopoietic multipotent progenitor cell
http://purl.obolibrary.org/obo/ZP_0102457	hepatocyte decreased occurrence cell population proliferation, abnormal	http://purl.obolibrary.org/obo/GO_0008283	cell population proliferation	http://purl.obolibrary.org/obo/ZFA_0009111	hepatocyte
http://purl.obolibrary.org/obo/ZP_0022172	hepatocyte decreased occurrence regeneration, abnormal	http://purl.obolibrary.org/obo/GO_0031099	regeneration	http://purl.obolibrary.org/obo/ZFA_0009111	hepatocyte
http://purl.obolibrary.org/obo/ZP_0018726	hindbrain decreased occurrence AMPA glutamate receptor clustering, abnormal	http://purl.obolibrary.org/obo/GO_0097113	AMPA glutamate receptor clustering	http://purl.obolibrary.org/obo/ZFA_0000029	hindbrain
http://purl.obolibrary.org/obo/ZP_0012450	hindbrain decreased occurrence cell proliferation in hindbrain ventricular zone, abnormal	http://purl.obolibrary.org/obo/GO_0021923	cell proliferation in hindbrain ventricular zone	http://purl.obolibrary.org/obo/ZFA_0000029	hindbrain
http://purl.obolibrary.org/obo/ZP_0018601	hindbrain decreased occurrence cell proliferation in hindbrain, abnormal	http://purl.obolibrary.org/obo/GO_0021534	cell proliferation in hindbrain	http://purl.obolibrary.org/obo/ZFA_0000029	hindbrain
http://purl.obolibrary.org/obo/ZP_0018603	hindbrain decreased occurrence neuron differentiation, abnormal	http://purl.obolibrary.org/obo/GO_0030182	neuron differentiation	http://purl.obolibrary.org/obo/ZFA_0000029	hindbrain
http://purl.obolibrary.org/obo/ZP_0021985	hyaloid vessel decreased occurrence angiogenesis, abnormal	http://purl.obolibrary.org/obo/GO_0001525	angiogenesis	http://purl.obolibrary.org/obo/ZFA_0005046	hyaloid vessel
http://purl.obolibrary.org/obo/ZP_0020643	hypothalamus decreased occurrence cell population proliferation, abnormal	http://purl.obolibrary.org/obo/GO_0008283	cell population proliferation	http://purl.obolibrary.org/obo/ZFA_0000032	hypothalamus
http://purl.obolibrary.org/obo/ZP_0019532	immature Schwann cell decreased occurrence cell population proliferation, abnormal	http://purl.obolibrary.org/obo/GO_0008283	cell population proliferation	http://purl.obolibrary.org/obo/ZFA_0001725	immature Schwann cell
http://purl.obolibrary.org/obo/ZP_0101705	immature gonad decreased occurrence female gonad development, abnormal	http://purl.obolibrary.org/obo/GO_0008585	female gonad development	http://purl.obolibrary.org/obo/ZFA_0005272	immature gonad
http://purl.obolibrary.org/obo/ZP_0101706	immature gonad decreased occurrence female somatic sex determination, abnormal	http://purl.obolibrary.org/obo/GO_0019101	female somatic sex determination	http://purl.obolibrary.org/obo/ZFA_0005272	immature gonad
http://purl.obolibrary.org/obo/ZP_0101703	immature gonad decreased occurrence germ cell development, abnormal	http://purl.obolibrary.org/obo/GO_0007281	germ cell development	http://purl.obolibrary.org/obo/ZFA_0005272	immature gonad
http://purl.obolibrary.org/obo/ZP_0103609	integument decreased occurrence iridophore differentiation, abnormal	http://purl.obolibrary.org/obo/GO_0050935	iridophore differentiation	http://purl.obolibrary.org/obo/ZFA_0000368	integument
http://purl.obolibrary.org/obo/ZP_0103608	integument decreased occurrence melanocyte differentiation, abnormal	http://purl.obolibrary.org/obo/GO_0030318	melanocyte differentiation	http://purl.obolibrary.org/obo/ZFA_0000368	integument
http://purl.obolibrary.org/obo/ZP_0100231	integument decreased occurrence proton export across plasma membrane, abnormal	http://purl.obolibrary.org/obo/GO_0120029	proton export across plasma membrane	http://purl.obolibrary.org/obo/ZFA_0000368	integument
http://purl.obolibrary.org/obo/ZP_0018933	intermediate cell mass of mesoderm decreased occurrence cell population proliferation, abnormal	http://purl.obolibrary.org/obo/GO_0008283	cell population proliferation	http://purl.obolibrary.org/obo/ZFA_0000033	intermediate cell mass of mesoderm
http://purl.obolibrary.org/obo/ZP_0103525	intermediate reticular formation decreased occurrence axon regeneration, abnormal	http://purl.obolibrary.org/obo/GO_0031103	axon regeneration	http://purl.obolibrary.org/obo/ZFA_0000219	intermediate reticular formation
http://purl.obolibrary.org/obo/ZP_0013878	interrenal gland decreased occurrence epithelial to mesenchymal transition, abnormal	http://purl.obolibrary.org/obo/GO_0001837	epithelial to mesenchymal transition	http://purl.obolibrary.org/obo/ZFA_0001345	interrenal gland
http://purl.obolibrary.org/obo/ZP_0011228	interrenal gland decreased occurrence steroid biosynthetic process, abnormal	http://purl.obolibrary.org/obo/GO_0006694	steroid biosynthetic process	http://purl.obolibrary.org/obo/ZFA_0001345	interrenal gland
http://purl.obolibrary.org/obo/ZP_0011590	intersegmental vein decreased occurrence cell population proliferation, abnormal	http://purl.obolibrary.org/obo/GO_0008283	cell population proliferation	http://purl.obolibrary.org/obo/ZFA_0001057	intersegmental vein
http://purl.obolibrary.org/obo/ZP_0020117	intersegmental vessel decreased occurrence blood vessel development, abnormal	http://purl.obolibrary.org/obo/GO_0001568	blood vessel development	http://purl.obolibrary.org/obo/ZFA_0001285	intersegmental vessel
http://purl.obolibrary.org/obo/ZP_0102409	intersegmental vessel decreased occurrence regeneration, abnormal	http://purl.obolibrary.org/obo/GO_0031099	regeneration	http://purl.obolibrary.org/obo/ZFA_0001285	intersegmental vessel
http://purl.obolibrary.org/obo/ZP_0019798	intersegmental vessel decreased occurrence sprouting angiogenesis, abnormal	http://purl.obolibrary.org/obo/GO_0002040	sprouting angiogenesis	http://purl.obolibrary.org/obo/ZFA_0001285	intersegmental vessel
http://purl.obolibrary.org/obo/ZP_0013889	intestinal epithelium decreased occurrence endocytosis, abnormal	http://purl.obolibrary.org/obo/GO_0006897	endocytosis	http://purl.obolibrary.org/obo/ZFA_0005124	intestinal epithelium
http://purl.obolibrary.org/obo/ZP_0100942	joint decreased occurrence cell migration, abnormal	http://purl.obolibrary.org/obo/GO_0016477	cell migration	http://purl.obolibrary.org/obo/ZFA_0001596	joint
http://purl.obolibrary.org/obo/ZP_0100941	joint decreased occurrence cell population proliferation, abnormal	http://purl.obolibrary.org/obo/GO_0008283	cell population proliferation	http://purl.obolibrary.org/obo/ZFA_0001596	joint
http://purl.obolibrary.org/obo/ZP_0020486	lateral plate mesoderm decreased occurrence cell migration, abnormal	http://purl.obolibrary.org/obo/GO_0016477	cell migration	http://purl.obolibrary.org/obo/ZFA_0000121	lateral plate mesoderm
http://purl.obolibrary.org/obo/ZP_0101740	lateral plate mesoderm decreased occurrence cell population proliferation, abnormal	http://purl.obolibrary.org/obo/GO_0008283	cell population proliferation	http://purl.obolibrary.org/obo/ZFA_0000121	lateral plate mesoderm
http://purl.obolibrary.org/obo/ZP_0100630	lateral plate mesoderm decreased occurrence tissue migration, abnormal	http://purl.obolibrary.org/obo/GO_0090130	tissue migration	http://purl.obolibrary.org/obo/ZFA_0000121	lateral plate mesoderm
http://purl.obolibrary.org/obo/ZP_0021887	lateral rectus decreased occurrence cell population proliferation, abnormal	http://purl.obolibrary.org/obo/GO_0008283	cell population proliferation	http://purl.obolibrary.org/obo/ZFA_0000383	lateral rectus
http://purl.obolibrary.org/obo/ZP_0021235	lens decreased occurrence enucleation, abnormal	http://purl.obolibrary.org/obo/GO_0090601	enucleation	http://purl.obolibrary.org/obo/ZFA_0000035	lens
http://purl.obolibrary.org/obo/ZP_0013936	lens epithelium decreased occurrence cell population proliferation, abnormal	http://purl.obolibrary.org/obo/GO_0008283	cell population proliferation	http://purl.obolibrary.org/obo/ZFA_0001326	lens epithelium
http://purl.obolibrary.org/obo/ZP_0104724	lens epithelium decreased occurrence early endosome to recycling endosome transport, abnormal	http://purl.obolibrary.org/obo/GO_0061502	early endosome to recycling endosome transport	http://purl.obolibrary.org/obo/ZFA_0001326	lens epithelium
http://purl.obolibrary.org/obo/ZP_0104723	lens epithelium decreased occurrence http://purl.obolibrary.org/obo/GO_0045022, abnormal	http://purl.obolibrary.org/obo/GO_0045022	early endosome to late endosome transport	http://purl.obolibrary.org/obo/ZFA_0001326	lens epithelium
http://purl.obolibrary.org/obo/ZP_0103265	liver decreased occurrence canonical Wnt signaling pathway, abnormal	http://purl.obolibrary.org/obo/GO_0060070	canonical Wnt signaling pathway	http://purl.obolibrary.org/obo/ZFA_0000123	liver
http://purl.obolibrary.org/obo/ZP_0011412	liver decreased occurrence cell population proliferation, abnormal	http://purl.obolibrary.org/obo/GO_0008283	cell population proliferation	http://purl.obolibrary.org/obo/ZFA_0000123	liver
http://purl.obolibrary.org/obo/ZP_0019237	liver decreased occurrence determination of liver left/right asymmetry, abnormal	http://purl.obolibrary.org/obo/GO_0071910	determination of liver left/right asymmetry	http://purl.obolibrary.org/obo/ZFA_0000123	liver
http://purl.obolibrary.org/obo/ZP_0021061	lymphangioblast cord decreased occurrence lymph vessel development, abnormal	http://purl.obolibrary.org/obo/GO_0001945	lymph vessel development	http://purl.obolibrary.org/obo/ZFA_0005605	lymphangioblast cord
http://purl.obolibrary.org/obo/ZP_0019483	macrophage decreased occurrence endocytic recycling, abnormal	http://purl.obolibrary.org/obo/GO_0032456	endocytic recycling	http://purl.obolibrary.org/obo/ZFA_0009141	macrophage
http://purl.obolibrary.org/obo/ZP_0104041	male organism decreased occurrence development of secondary male sexual characteristics, abnormal	http://purl.obolibrary.org/obo/GO_0046544	development of secondary male sexual characteristics	http://purl.obolibrary.org/obo/ZFA_0000242	male organism
http://purl.obolibrary.org/obo/ZP_0103411	mandibular arch skeleton decreased occurrence cartilage development, abnormal	http://purl.obolibrary.org/obo/GO_0051216	cartilage development	http://purl.obolibrary.org/obo/ZFA_0001227	mandibular arch skeleton
http://purl.obolibrary.org/obo/ZP_0104153	medial caudal lobe decreased occurrence cerebellar granule cell differentiation, abnormal	http://purl.obolibrary.org/obo/GO_0021707	cerebellar granule cell differentiation	http://purl.obolibrary.org/obo/ZFA_0000388	medial caudal lobe
http://purl.obolibrary.org/obo/ZP_0101333	medial longitudinal fasciculus decreased occurrence axonal fasciculation, abnormal	http://purl.obolibrary.org/obo/GO_0007413	axonal fasciculation	http://purl.obolibrary.org/obo/ZFA_0000543	medial longitudinal fasciculus
http://purl.obolibrary.org/obo/ZP_0017515	median fin fold decreased occurrence epithelial cell proliferation, abnormal	http://purl.obolibrary.org/obo/GO_0050673	epithelial cell proliferation	http://purl.obolibrary.org/obo/ZFA_0000040	median fin fold
http://purl.obolibrary.org/obo/ZP_0103600	melanocyte decreased occurrence cellular pigmentation, abnormal	http://purl.obolibrary.org/obo/GO_0033059	cellular pigmentation	http://purl.obolibrary.org/obo/ZFA_0009091	melanocyte
http://purl.obolibrary.org/obo/ZP_0012211	melanocyte decreased occurrence cellular response to light intensity, abnormal	http://purl.obolibrary.org/obo/GO_0071484	cellular response to light intensity	http://purl.obolibrary.org/obo/ZFA_0009091	melanocyte
http://purl.obolibrary.org/obo/ZP_0014281	mesenchyme decreased occurrence cell population proliferation, abnormal	http://purl.obolibrary.org/obo/GO_0008283	cell population proliferation	http://purl.obolibrary.org/obo/ZFA_0000393	mesenchyme
http://purl.obolibrary.org/obo/ZP_0012171	mesenchyme pectoral fin decreased occurrence cell population proliferation, abnormal	http://purl.obolibrary.org/obo/GO_0008283	cell population proliferation	http://purl.obolibrary.org/obo/ZFA_0001000	mesenchyme pectoral fin
http://purl.obolibrary.org/obo/ZP_0020631	microglial cell decreased occurrence lysosomal protein catabolic process, abnormal	http://purl.obolibrary.org/obo/GO_1905146	lysosomal protein catabolic process	http://purl.obolibrary.org/obo/ZFA_0009077	microglial cell
http://purl.obolibrary.org/obo/ZP_0008595	midbrain decreased occurrence cell population proliferation, abnormal	http://purl.obolibrary.org/obo/GO_0008283	cell population proliferation	http://purl.obolibrary.org/obo/ZFA_0000128	midbrain
http://purl.obolibrary.org/obo/ZP_0101845	motor neuron decreased occurrence synaptic vesicle clustering, abnormal	http://purl.obolibrary.org/obo/GO_0097091	synaptic vesicle clustering	http://purl.obolibrary.org/obo/ZFA_0009052	motor neuron
http://purl.obolibrary.org/obo/ZP_0018788	myeloid lineage restricted progenitor cell decreased occurrence myeloid leukocyte migration, abnormal	http://purl.obolibrary.org/obo/GO_0097529	myeloid leukocyte migration	http://purl.obolibrary.org/obo/ZFA_0009356	myeloid lineage restricted progenitor cell
http://purl.obolibrary.org/obo/ZP_0101632	myoblast decreased occurrence cell-matrix adhesion, abnormal	http://purl.obolibrary.org/obo/GO_0007160	cell-matrix adhesion	http://purl.obolibrary.org/obo/ZFA_0009025	myoblast
http://purl.obolibrary.org/obo/ZP_0102768	myocardial precursor decreased occurrence cardioblast migration to the midline involved in heart field formation, abnormal	http://purl.obolibrary.org/obo/GO_0060975	cardioblast migration to the midline involved in heart field formation	http://purl.obolibrary.org/obo/ZFA_0005490	myocardial precursor
http://purl.obolibrary.org/obo/ZP_0019263	myotome decreased occurrence striated muscle cell differentiation, abnormal	http://purl.obolibrary.org/obo/GO_0051146	striated muscle cell differentiation	http://purl.obolibrary.org/obo/ZFA_0001056	myotome
http://purl.obolibrary.org/obo/ZP_0020802	neural crest cell decreased occurrence cell population proliferation, abnormal	http://purl.obolibrary.org/obo/GO_0008283	cell population proliferation	http://purl.obolibrary.org/obo/ZFA_0009165	neural crest cell
http://purl.obolibrary.org/obo/ZP_0100254	neural crest decreased occurrence cell population proliferation, abnormal	http://purl.obolibrary.org/obo/GO_0008283	cell population proliferation	http://purl.obolibrary.org/obo/ZFA_0000045	neural crest
http://purl.obolibrary.org/obo/ZP_0012382	neurohypophysis decreased occurrence innervation, abnormal	http://purl.obolibrary.org/obo/GO_0060384	innervation	http://purl.obolibrary.org/obo/ZFA_0001271	neurohypophysis
http://purl.obolibrary.org/obo/ZP_0012381	neurohypophysis decreased occurrence vasculogenesis, abnormal	http://purl.obolibrary.org/obo/GO_0001570	vasculogenesis	http://purl.obolibrary.org/obo/ZFA_0001271	neurohypophysis
http://purl.obolibrary.org/obo/ZP_0014914	neuromast decreased occurrence cell population proliferation, abnormal	http://purl.obolibrary.org/obo/GO_0008283	cell population proliferation	http://purl.obolibrary.org/obo/ZFA_0000243	neuromast
http://purl.obolibrary.org/obo/ZP_0021735	neuromast hair cell decreased occurrence cell population proliferation, abnormal	http://purl.obolibrary.org/obo/GO_0008283	cell population proliferation	http://purl.obolibrary.org/obo/ZFA_0009367	neuromast hair cell
http://purl.obolibrary.org/obo/ZP_0016785	neuromast hair cell decreased occurrence regeneration, abnormal	http://purl.obolibrary.org/obo/GO_0031099	regeneration	http://purl.obolibrary.org/obo/ZFA_0009367	neuromast hair cell
http://purl.obolibrary.org/obo/ZP_0021734	neuromast support cell decreased occurrence cell population proliferation, abnormal	http://purl.obolibrary.org/obo/GO_0008283	cell population proliferation	http://purl.obolibrary.org/obo/ZFA_0009363	neuromast support cell
http://purl.obolibrary.org/obo/ZP_0101753	neuronal stem cell decreased occurrence cell population proliferation, abnormal	http://purl.obolibrary.org/obo/GO_0008283	cell population proliferation	http://purl.obolibrary.org/obo/ZFA_0009019	neuronal stem cell
http://purl.obolibrary.org/obo/ZP_0102233	notochord decreased occurrence axis elongation, abnormal	http://purl.obolibrary.org/obo/GO_0003401	axis elongation	http://purl.obolibrary.org/obo/ZFA_0000135	notochord
http://purl.obolibrary.org/obo/ZP_0022162	notochord decreased occurrence neutrophil activation involved in immune response, abnormal	http://purl.obolibrary.org/obo/GO_0002283	neutrophil activation involved in immune response	http://purl.obolibrary.org/obo/ZFA_0000135	notochord
http://purl.obolibrary.org/obo/ZP_0100154	nucleate erythrocyte decreased occurrence hemoglobin biosynthetic process, abnormal	http://purl.obolibrary.org/obo/GO_0042541	hemoglobin biosynthetic process	http://purl.obolibrary.org/obo/ZFA_0009256	nucleate erythrocyte
http://purl.obolibrary.org/obo/ZP_0102196	nucleus of the medial longitudinal fasciculus medulla oblongata decreased occurrence axon regeneration, abnormal	http://purl.obolibrary.org/obo/GO_0031103	axon regeneration	http://purl.obolibrary.org/obo/ZFA_0000815	nucleus of the medial longitudinal fasciculus medulla oblongata
http://purl.obolibrary.org/obo/ZP_0100726	oligodendrocyte decreased occurrence MAPK cascade, abnormal	http://purl.obolibrary.org/obo/GO_0000165	MAPK cascade	http://purl.obolibrary.org/obo/ZFA_0009076	oligodendrocyte
http://purl.obolibrary.org/obo/ZP_0021517	oligodendrocyte decreased occurrence TOR signaling, abnormal	http://purl.obolibrary.org/obo/GO_0031929	TOR signaling	http://purl.obolibrary.org/obo/ZFA_0009076	oligodendrocyte
http://purl.obolibrary.org/obo/ZP_0101803	oligodendrocyte decreased occurrence cell population proliferation, abnormal	http://purl.obolibrary.org/obo/GO_0008283	cell population proliferation	http://purl.obolibrary.org/obo/ZFA_0009076	oligodendrocyte
http://purl.obolibrary.org/obo/ZP_0103478	oocyte stage I decreased occurrence establishment of cell polarity, abnormal	http://purl.obolibrary.org/obo/GO_0030010	establishment of cell polarity	http://purl.obolibrary.org/obo/ZFA_0001567	oocyte stage I
http://purl.obolibrary.org/obo/ZP_0100277	oocyte stage I decreased occurrence organelle disassembly, abnormal	http://purl.obolibrary.org/obo/GO_1903008	organelle disassembly	http://purl.obolibrary.org/obo/ZFA_0001567	oocyte stage I
http://purl.obolibrary.org/obo/ZP_0012618	opercle decreased occurrence bone mineralization, abnormal	http://purl.obolibrary.org/obo/GO_0030282	bone mineralization	http://purl.obolibrary.org/obo/ZFA_0000250	opercle
http://purl.obolibrary.org/obo/ZP_0100704	optic cup decreased occurrence cell population proliferation, abnormal	http://purl.obolibrary.org/obo/GO_0008283	cell population proliferation	http://purl.obolibrary.org/obo/ZFA_0001202	optic cup
http://purl.obolibrary.org/obo/ZP_0019855	optic tectum decreased occurrence anterograde trans-synaptic signaling, abnormal	http://purl.obolibrary.org/obo/GO_0098916	anterograde trans-synaptic signaling	http://purl.obolibrary.org/obo/ZFA_0000445	optic tectum
http://purl.obolibrary.org/obo/ZP_0019751	optic tectum decreased occurrence apoptotic cell clearance, abnormal	http://purl.obolibrary.org/obo/GO_0043277	apoptotic cell clearance	http://purl.obolibrary.org/obo/ZFA_0000445	optic tectum
http://purl.obolibrary.org/obo/ZP_0103245	optic tectum decreased occurrence cellular response to light stimulus, abnormal	http://purl.obolibrary.org/obo/GO_0071482	cellular response to light stimulus	http://purl.obolibrary.org/obo/ZFA_0000445	optic tectum
http://purl.obolibrary.org/obo/ZP_0019712	optic tectum decreased occurrence innervation, abnormal	http://purl.obolibrary.org/obo/GO_0060384	innervation	http://purl.obolibrary.org/obo/ZFA_0000445	optic tectum
http://purl.obolibrary.org/obo/ZP_0104426	optic tectum decreased occurrence negative regulation of neuronal action potential, abnormal	http://purl.obolibrary.org/obo/GO_1904456	negative regulation of neuronal action potential	http://purl.obolibrary.org/obo/ZFA_0000445	optic tectum
http://purl.obolibrary.org/obo/ZP_0102505	optic tectum decreased occurrence neuron death, abnormal	http://purl.obolibrary.org/obo/GO_0070997	neuron death	http://purl.obolibrary.org/obo/ZFA_0000445	optic tectum
